,title,reading_time,like,writers,date
3186,Benchmarking Your (HealthTech) Startup? A Framework Around Metrics,4,1,Amit Garg,2022-07-11
3187,Alternative Data Sets Are Not as Ambiguous as You May Think.,6,70,Bright Data,2022-07-11
3188,Will Cryptocurrency have any future?,3,59,Vishnuaravi,2022-07-11
3189,What the Bargain Cryptocurrency Token RUNE Could Mean for Your Portfolio,5,651,Stephen Dalton,2022-07-11
3190,A Lesson on Kindness From a Vietnamese Coffee Shop,4,560,Paul Dermody,2022-07-11
3191,$500 Opportunity Lost: Don’t Repeat My Mistakes (These Are Everywhere!),4,21,Dylan Cunningham,2022-07-11
3192,"This Untraditional Market Outperformed Crypto, Stocks and Real Estate Over The Last 2 Years",3,4,Marx D.,2022-07-11
3193,"<strong class=""markup--strong markup--h3-strong"">Top 7 Crypto Hacks That Shook The Digital World</strong>",5,67,Dwarf AI,2022-07-11
3194,"<strong class=""markup--strong markup--h3-strong"">A Hidden Security Hole In Every Organization And How To Plug It</strong>",6,11,Alex Panagides,2022-07-11
3196,Elon Musk Is Withdrawing From the Twitter Transaction After Selling $8 Billion in Tesla (Tsla) Shares for It,3,1,slashdotted,2022-07-11
3197,I Will Find Out How Important This Is for Europe and the United States,7,50,Mats Larsson,2022-07-11
3199,Avoid Credit Cards If You Fall Into This Description,3,11,Destiny S. Harris,2022-07-11
3201,"Yes, A 9–5 Can Make You Rich",5,387,Arron Fornasetti,2022-07-12
3202,How Most Millionaires Make Their Money Featuring Dave Ramsey,4,50,Shimon Brathwaite,2022-07-12
3203,How Much YouTube Paid Me for 1 Million Views?,11,78,Dr. Ming,2022-07-12
3204,"<strong class=""markup--strong markup--h3-strong"">Luxury watches and handbags might be the best recession-proof assets</strong>",3,65,Julia Baldet,2022-07-12
3205,Is The Crypto Bottom Here Yet?,6,38,Ann,2022-07-12
3206,12 Amazing Practices to Simplify Flutter App Development,7,13,XongoLab Technologies,2022-07-12
3207,Does Techincal Analysis Really Work?— Here’s What You Need To Know,7,71,Bees & Honey Money,2022-07-12
3208,3 Reasons Wealth Inequality is Actually Good,8,111,Millan Singh,2022-07-12
3209,What is the Future of NFTs in the World of Web 3.0? Top NFT Business Models That Will Work Out,5,10,Markdomain,2022-07-12
3210,Introduction to BigQuery on Google Cloud Platform — Part 1,7,103,Naina Chaturvedi,2022-07-12
3211,What to Expect From the Global Economy in Q3,7,81,Meziechi Nwogu,2022-07-12
3212,Cummins Inc. — 6 Attractive facts each investor should know⚒️,5,77,ARTInvest,2022-07-12
3213,Introduction to BigQuery on Google Cloud Platform — Part 2,6,101,Naina Chaturvedi,2022-07-12
3214,"<strong class=""markup--strong markup--h3-strong"">How To Launch A Community-Centric NFT Marketplace?</strong>",6,50,William Hill,2022-07-12
3215,Don’t sweat over these,5,6,Baijayanta Roy,2022-07-12
3217,What I’m Doing In This Terrible Economy,3,15,Mohamad Hakim,2022-07-12
3218,Crypto Madness,3,225,Brian Dickens Barrabee,2022-07-12
3219,10 Steps To Change Career At Any Age,3,1,Gil Mahesh,2022-07-12
3220,When is the Right Time to Replace Your WMS and How?,6,73,Maja Dakić,2022-07-12
3221,Why trees matter for our wellbeing,5,151,Joachim Bervoets,2022-07-12
3223,Your Company Needs Funding?,6,2,Marc Patterson,2022-07-12
3224,The event that could change crypto forever is here,7,952,Ignacio de Gregorio,2022-07-13
3225,Google Will Postpone Recruiting Until 2023,2,51,slashdotted,2022-07-13
3227,"<strong class=""markup--strong markup--h3-strong"">Is Elon Musk right about Twitter (TWTR)?</strong>",6,14,Daniel G. Jennings,2022-07-13
3228,Coca-Cola stock is recession-proof: Jim Cramer,3,83,Wajeeh Khan,2022-07-13
3229,"<strong class=""markup--strong markup--h3-strong"">A Quick Overview of the iShares Russell 2000 ETF</strong>",2,7,Tunji Onigbanjo,2022-07-13
3231,Why is Data Visualization important in your Blog Writing?,5,1,Rijul Singh Malik,2022-07-13
3232,Three Habits for Getting Better Health,3,2,Saurabh Adhane,2022-07-13
3235,How I’m Responsibly Using Credit Cards to Boost My Income,7,30,Drew Cordell,2022-07-13
3236,KnockKnock 🚪✊ — Alerting in 2 Additional Lines,3,3,Shaurya Uppal,2022-07-13
3238,Amouranth Leaks Her OnlyFans Earnings,3,1940,KD Writes,2022-07-14
3239,Baffling Ancient Inventions,5,66,Dean Gee,2022-07-14
3240,Elon Musk’s impact on Twitter and Tesla’s stock price,7,199,Mala Deep,2022-07-14
3241,The US Economy Is Much Worse Than We Thought,4,33,Carlos Pascual,2022-07-14
3242,Profit from Volatility with Long Straddles,8,36,Antoine Dedave,2022-07-14
3243,"<strong class=""markup--strong markup--h3-strong"">Monero Is a More Secure Cryptocurrency Than Bitcoin. Many Don’t Understand This</strong>",3,63,Paulo A. José,2022-07-14
3244,The 4 Best (Simple) Movies About Finance & Investing,5,54,Thomas Herold,2022-07-14
3245,Precautions to take before the Recession — for Freelancers and Employed People,3,51,Muhammad Adeel,2022-07-14
3246,Blockchain — for investors.,7,51,Kunal Vaidya,2022-07-14
3247,How to be Successful on the Stock Market,3,161,Mike Toney-Hoffman,2022-07-14
3248,Develop Your Creativity Instantly in 12 Minutes: Find 12 Things You Would Love to Learn NOW!,7,7,Fahri Karakas,2022-07-14
3249,Reaching Your Digital Audience,6,5,Dean Gee,2022-07-14
3250,Your Most Important Marketing Weapon,5,2,Ed Newman,2022-07-14
3251,June Inflation,4,89,Dave Coker,2022-07-14
3253,Trading Plan: 14 July 2022,4,2,Laurentiu Chisca,2022-07-14
3254,Key Indicator Shows China’s Economy Set For Further Slump,2,3,Simon Constable,2022-07-14
3255,In Search of Universal Utility & Unknown Value,4,170,Daniel Mark Harrison,2022-07-14
3256,Twitter and Musk,3,55,Dean Gee,2022-07-14
3257,More than 500 women have filed sexual assault allegations against Uber.,2,9,slashdotted,2022-07-14
3258,These Three Indicators Will Tell You When the Bear Market Ends,5,233,Ardi Aaziznia,2022-07-15
3259,Next FOMC Meeting July 27th What about US Interest Rates?,3,8,Dave Coker,2022-07-15
3260,What Makes the Cryptocurrency Quant Unique,7,693,Stephen Dalton,2022-07-15
3261,Pix2Pix: Image-to-image translation with a conditional GAN,10,7,Manikanth,2022-07-15
3262,How Bitcoin Became Wealth Destroyer Of The Century,3,54,Saurabh Adhane,2022-07-15
3263,How NFTs Are Disrupting the Sports Industry,8,1000,Tendai Tomu,2022-07-15
3264,"<strong class=""markup--strong markup--h3-strong"">Who’s Losing Money in the Stock Market in this Down Time? Nobody.</strong>",4,11,Paulo A. José,2022-07-15
3265,Hodler’s Are The Bank of Last Resort In a World of Free Market Banking On The Bitcoin Standard,13,38,Ugly Old Goat,2022-07-15
3266,Taking a Look at How The Biggest Companies are Going to Use Blockchain,4,144,Abby R,2022-07-15
3267,My Psychology of Money,9,1100,Jing Zhe,2022-07-15
3268,"<strong class=""markup--strong markup--h3-strong"">Are the FAANG Stocks Recession Proof?</strong>",5,31,Daniel G. Jennings,2022-07-15
3269,How to Make Money with Only Plans,4,598,Aliza Rosenfelder,2022-07-15
3270,Why You Need to Seriously Consider ESG Investing,4,6,Abby R,2022-07-15
3271,The 4 Language Processing Techniques You Should Know How To Use,6,4,Rijul Singh Malik,2022-07-15
3272,What is DAO?? Is it all a joke?,1,402,Sasha Andrieiev,2022-07-15
3273,"<strong class=""markup--strong markup--h3-strong"">Meta Platforms Stock Down Over 50% Year-to-Date is ‘Not a Buy’</strong>",2,125,Wajeeh Khan,2022-07-15
3274,Work/Life Balance — Is Nonsense or All About Priorities,3,19,Muhammad Adeel,2022-07-15
3275,Should You Use a Credit Card?,2,109,Mike Toney-Hoffman,2022-07-15
3276,7 High-Income Skills to Learn in 2022,5,6,Jerry Keszka,2022-07-16
3277,Study Guide For The GSE (GIAC Security Expert): Part 3,5,7,Dennis Chow,2022-07-16
3278,Image Visualization in Tableau with Python,4,57,Anuj Karn,2022-07-16
3279,"Dracula, Romania’s Hero",5,832,Stefan Pircalabu,2022-07-16
3280,Creating NFT Marketplace to Buy NFTs In-Game: What Game Developers Should Know to Launch NFT Game Marketplace?,5,11,Markdomain,2022-07-16
3281,"<strong class=""markup--strong markup--h3-strong"">Advantages of Outsourcing to An Offshore Development Center (ODC)</strong>",7,8,Gautam Raturi,2022-07-16
3282,Conscious Spending Vs. Budgeting,2,541,Nate Meharg,2022-07-16
3283,"<strong class=""markup--strong markup--h3-strong"">Netflix Could Lose 2.8 Million Paid Subscribers This Quarter</strong>",2,169,Wajeeh Khan,2022-07-16
3284,How healthy is The US consumer?,4,56,Dave Coker,2022-07-16
3285,Is Your Portfolio Ready for Global Warming?,3,6,Abby R,2022-07-16
3286,Why estimating the number of bots in Twitter is not an ML problem and 100 accounts per day is sufficient,6,207,Lak Lakshmanan,2022-07-17
3288,How to Escape From Middle-Class Trap,3,136,Saurabh Adhane,2022-07-17
3289,How to Read Annual Reports as Swiftly as Warren Buffett,4,109,Jason Huynh,2022-07-17
3290,Why on earth is BMW doing this?,6,99,Ignacio de Gregorio,2022-07-17
3291,Make Your GitHub Profile Look Appealing,4,229,Muhammad Adeel,2022-07-17
3292,‘Finance Influencers’ Need to Stop,3,23,Mohamad Hakim,2022-07-17
3293,The Bond Market Bubble All Good Things Must End,4,100,Dave Coker,2022-07-17
3295,5 types of people you should avoid in a startup,5,674,Stefan Pircalabu,2022-07-17
3296,Stock Market Updates. 3 things to know — 18 July 2022,3,36,ARTInvest,2022-07-17
3297,Use These Nassim Taleb Ideas To Build Wealth and Resilience,5,188,Jason Huynh,2022-07-18
3298,Orbot: Your “VPN-like” Tor Connection For Android,3,1,Sam Writes Security,2022-07-18
3299,The Future of Linguistics,6,1,Rijul Singh Malik,2022-07-18
3300,6 Key Facts About Stop Losses In Trading (Must Know!),7,151,Bees & Honey Money,2022-07-18
3301,5 Smart Money Habits to Consider During a Recession,3,4,Abby R,2022-07-18
3302,Why Buying On Dips Doesn’t Work In Bitcoin Investing,3,1,Saurabh Adhane,2022-07-18
3303,Force Majeure!,8,1,Sagar Singh Setia,2022-07-18
3304,"<strong class=""markup--strong markup--h3-strong"">Accelerating the Energy Transition with Web3</strong>",3,75,Alexis Pappas,2022-07-18
3305,How I’m Learning A New Language — And How It’s Actually Working,4,134,Bernie E. Robert,2022-07-18
3307,Intelligent Inertia as an Investment Strategy,3,51,Vlad Gogish,2022-07-18
3308,Steps to Take Before Investing in any Company,4,50,Sharyph,2022-07-18
3309,Can Companies Afford to Develop Both Electric and Petrol/Diesel?,6,1,Mats Larsson,2022-07-18
3310,Don’t You Hate Those Clickbait Titles That Go on-and-on and Never Give You the Prize,4,623,Stephen Dalton,2022-07-18
3311,Interest rates up,2,56,Dave Coker,2022-07-18
3312,I Think That We Do Care,7,50,Øivind H. Solheim,2022-07-18
3314,Collaboration as Good as Money as Businesses Seek Leadership Roles,6,3,Jim Katzaman - Get Out of Debt,2022-07-18
3315,Top 10 Play-to-Earn Crypto Games in 2022,7,18,Gautam Raturi,2022-07-19
3316,Averaging $1k/Month on Medium: a Detailed Guide,22,404,Aure's Notes,2022-07-19
3317,PooCoin: Explained for Cryptocurrency Beginners,5,67,Christopher Kokoski,2022-07-19
3318,How To Make Enough Money to Retire in 5 Years,6,203,Desiree Peralta,2022-07-19
3319,Liz Truss’ economic plan is diabolically bad,4,51,Zorawar,2022-07-19
3320,Best Financial Advice For Young People,3,11,Saurabh Adhane,2022-07-19
3321,Welcome to the Metaverse: where are we?,11,61,Shachar Oz,2022-07-19
3322,"<strong class=""markup--strong markup--h3-strong"">XPO Logistics Stock Price Could Shoot Up 50% in the Coming Months</strong>",2,171,Wajeeh Khan,2022-07-19
3323,5 Charts Show Inflation Might Have Peaked Already,5,10,"Spyros Ierides, CFA",2022-07-19
3324,What is ETL: the ultimate guide 101,11,440,Marie Sharapa,2022-07-19
3325,Are You a Gray Knight Entrepreneur?,6,77,Tica Darius,2022-07-19
3327,Democrats and Republicans Now Have Something Major in Common,3,261,Joshua Gane,2022-07-19
3328,"50,000+ Organic Traffic Monthly — 5 Hidden Secrets to Follow",4,56,Brian Smith,2022-07-19
3329,Lazy Employees Dominate the Project,2,142,Aydın Fevzi Özçekiç,2022-07-19
3330,"<strong class=""markup--strong markup--h3-strong"">Engineering the Future from Astronomy to Augmented Reality</strong>",4,41,Tullio Siragusa,2022-07-19
3331,Kick Start Your Career As A Developer in Blockchain Industry,3,23,Vedant Dwivedi,2022-07-19
3332,Crypto Societies — a Network States Future,4,57,Jasper Ruijs🚀,2022-07-19
3333,"How to make $5K to $15K per month from your E-Commerce Online Store on Etsy, Shopify, Amazon with Pinterest Marketing",6,105,Himangshu Sharma,2022-07-19
3334,Are We Getting Distracted By AI? Data-based Care,3,2,Amit Garg,2022-07-19
3335,Stocks to focus before Q2 earnings,3,8,Syam KP | Gulf Brokers,2022-07-19
3336,Hasn’t your divorce cost you enough already?,4,2,Michael Schwartz,2022-07-19
3337,"<strong class=""markup--strong markup--h3-strong"">Zillow Bought Homes and It Failed Embarrassingly: Algorithm Lessons from A $500 Million Money Pit</strong>",10,67,Ken Jee,2022-07-20
3338,Is this the holy grail of crypto?,8,299,Ignacio de Gregorio,2022-07-20
3339,"<strong class=""markup--strong markup--h3-strong"">Here’s Why Nobody Cares About NFTs Anymore</strong>",3,19,Paulo A. José,2022-07-20
3340,"10 Short Book Reviews: Viking Law, Backgammon Strategy, The History of Alchemy and more...",9,57,Scott H. Young,2022-07-20
3341,Why does Switzerland Refuse to Join the European Union?,3,45,slashdotted,2022-07-20
3342,"<strong class=""markup--strong markup--h3-strong"">Does The LinkedIn Machine Learning Assessment Matter For Talent Recruitment?</strong>",5,72,Ken Jee,2022-07-20
3343,7 Chrome Settings You Need to Change Immediately,5,2,Jerry Keszka,2022-07-20
3344,Why You Are Not Achieving Any Financial Goal Yet,6,119,Desiree Peralta,2022-07-20
3345,Python in web browser directly from HTML!!!!,3,2,Anuj Karn,2022-07-20
3346,Why I Sold Bitcoin Worth $10k,3,9,Saurabh Adhane,2022-07-20
3347,2 Financial Stocks With High Yields And Covered Call Income Plays,4,48,Mark Hake,2022-07-20
3348,"Purple Tea’s Unique Anti-Oxidants, Kenya’s Nutrition Secret",4,17,Dean Gee,2022-07-20
3349,7 Things That Will Ruin Your Reputation At Work,3,26,Gil Mahesh,2022-07-20
3350,"Blame Capitalism, Corporate Greed, and Putin",6,97,David James,2022-07-20
3351,How I Prevent Inflation from Pummeling Me,7,7,Drew Cordell,2022-07-20
3352,How does the Fed Bank Affect the U.S. Economy and Asset Prices?,8,2,"Bruce H. Cottman, Ph.D.",2022-07-20
3353,Best 5 Hiring Intelligence Platforms in 2022,3,2,Kelsey Foster,2022-07-20
3355,"<strong class=""markup--strong markup--h3-strong"">Will Inflation Kill Target (TGT)?</strong>",5,2,Daniel G. Jennings,2022-07-20
3356,How to Invest Smarter After Learning COVID Market Behavior,5,52,Abby R,2022-07-20
3357,Why Investors Should Focus More On The Infrastructure Supporting The AI Revolution,5,3,Basil Alomary,2022-07-20
3359,Tried pitching your services? Here’s a ‘no pitch’ option,2,24,Chris Gardener,2022-07-20
3361,What Happened When I Started One Meal a Day For a Month,3,99,Saurabh Adhane,2022-07-21
3362,"<strong class=""markup--strong markup--h3-strong"">How to Become Rich the Swiss Way</strong>",8,2,"Olegs Jemeljanovs, PhD, CFA",2022-07-21
3364,5 Signs Your Boss Doesn’t Appreciate You,4,1,Gil Mahesh,2022-07-21
3365,"<strong class=""markup--strong markup--h3-strong"">Are There Signs That Inflation is Almost Over?</strong>",3,14,Joseph Liebreich,2022-07-21
3366,The Renaissance Man Is Dead. The Internet Killed Him,4,46,Bernie E. Robert,2022-07-21
3367,US in recession,3,79,Dave Coker,2022-07-21
3368,15 Quick Habits That Make You Better Every Day,2,61,Lukas Schwekendiek,2022-07-21
3369,"Before You “Chase Dividends,” Here’s What You Need To Know",4,50,Marcus Tan,2022-07-21
3370,Tools For Optimizing Website Speed And Performance,5,92,Muhammad Adeel,2022-07-21
3372,Is it Time to Replace Powell and Yellen?,4,25,Michael Busler,2022-07-21
3373,Remote Mentoring for Effective Integration of Junior Employees,10,516,Dr. Gleb Tsipursky,2022-07-21
3375,"<strong class=""markup--strong markup--h3-strong"">Here’s Why Cryptocurrencies Are More Popular Than Mutual Funds</strong>",3,2,Paulo A. José,2022-07-21
3376,Are You a Celsius Customer? Here’s What You Need To Do,2,108,Thomas Guenter,2022-07-22
3377,A Practical Guide to LambdaMART in LightGbm,4,40,Akash Dubey,2022-07-22
3378,Christians Will Have Anal Sex to Remain Pure,4,239,Joshua Gane,2022-07-22
3379,Savings rate collapses!,3,7,Dave Coker,2022-07-22
3380,"<strong class=""markup--strong markup--h3-strong"">Is Goldman Sachs (GS) Recession Resistant?</strong>",6,1,Daniel G. Jennings,2022-07-22
3381,Razia Sultan — Fearless Women Leader,3,11,Anita Tailor,2022-07-22
3382,Artificial Intelligence - Universal Field,12,63,Shafi,2022-07-22
3383,Trading vs Investing: Everything You Need to Know,3,285,ARTInvest,2022-07-22
3384,7 Best Smartphone Apps You Shouldn't Live Without,5,480,Jerry Keszka,2022-07-23
3385,Netflix — Data Exploration and Visualization,6,80,Shagun Sharma,2022-07-23
3386,"<strong class=""markup--strong markup--h3-strong"">Bitcoin Will Still Stay Below $10,000. Here Are 4 Big Reasons Why</strong>",4,129,Paulo A. José,2022-07-23
3387,A 10-Year Real Estate Investment Plan to Become a Millionaire,9,204,Abby R,2022-07-23
3388,The “One” Options Trading Strategy for Small Accounts,3,196,Sharyph,2022-07-23
3389,Is the Cryptocurrency Verasity (VRA) a Meme Coin?,7,467,Stephen Dalton,2022-07-23
3390,When to buy Bitcoin?,4,21,Richard Knight,2022-07-23
3391,How to Start Value Investing As a Data Scientist,5,47,Jason Huynh,2022-07-23
3392,Why Real Estate Remains One of the Best Sources of Investments,6,128,Desiree Peralta,2022-07-23
3393,"<strong class=""markup--strong markup--h3-strong"">When the Dollar Goes Up, the Price of Gold Will Always Goes Down. Many Still Don’t Understand This</strong>",4,3,Paulo A. José,2022-07-23
3394,5 Lessons (In Finance) From An Increasingly Global World,4,56,Carlos Pascual,2022-07-23
3395,"<strong class=""markup--strong markup--h3-strong"">Snapchat stock down 80% this year is “still not a buy”</strong>",4,189,Wajeeh Khan,2022-07-23
3396,How to Calculate the Breakeven Point of Your Options Trade,2,52,Mike Toney-Hoffman,2022-07-23
3397,"Four Simple Ways I’m Saving an Extra $4,853.82 per Year",8,101,Drew Cordell,2022-07-23
3398,Is the Google LaMDA Chatbot Sentient Life?,4,68,Dave Rauschenfels,2022-07-23
3399,"<strong class=""markup--strong markup--h3-strong"">It Is Easier To Launder Money With Euros And Dollars Than With Cryptocurrencies. And Governments Know It</strong>",4,4,Paulo A. José,2022-07-23
3400,How to Future-Proof Your Leadership (Video & Podcast),14,250,Dr. Gleb Tsipursky,2022-07-23
3401,Your 9–5 Job Is Your Starter Pack To Entrepreneurship,4,162,Benny Lim,2022-07-23
3404,Why More Money Can’t Make You Happy,3,17,Saurabh Adhane,2022-07-23
3405,Crypto scams uncovered: How to keep your cryptocurrency safe,5,134,Hekuran Gashi,2022-07-23
3407,Did You Decide To (Finally!) Make Yourself Rich? You Need These 6 Rules,3,4,Gil Mahesh,2022-07-23
3408,Spike Pattern Association Neuron (SPAN) Learning Model,3,8,Ayon Datta,2022-07-23
3409,10 Office Things That Steal Away Your Health,4,1,Gil Mahesh,2022-07-23
3410,Does This Post Contain Free Crypto?,6,7,Joel Kite,2022-07-23
3411,Why Tech and Crypto are crashing hard,11,120,Devansh- Machine Learning Made Simple,2022-07-24
3412,What Is So Scary about Blacks and Mexicans?,5,688,Joshua Gane,2022-07-24
3413,How To Ace Your Job Interview: Advice From A Tech CEO,13,1,"Rachel Draelos, MD, PhD",2022-07-24
3414,I.C.E. Allowed to Terrorize Immigrants Like My Wife Again with Impunity,5,360,Joshua Gane,2022-07-24
3415,The Universal Excuse for Failure,2,494,Brian Dickens Barrabee,2022-07-24
3416,3 Ways To Bring Creativity Into Your Management,3,132,Aliza Rosenfelder,2022-07-24
3417,Stock Market Updates. Big Tech Earnings and Fed Meeting next week — 25 July 2022,3,118,ARTInvest,2022-07-24
3418,The Fed and Jobs,3,48,Dave Coker,2022-07-24
3419,The Rule That The Most Successful People Follow: Focusing On Learning That Doesn’t Expire,7,340,Havard Mela,2022-07-25
3420,How Japan Become The Third Largest Economy In The World,13,43,Arsalan Haroon,2022-07-25
3421,Battle continues: Task Manager Things 3 vs Sorted 3,6,81,Kaushik Trivedi,2022-07-25
3422,Realized Volatility Analysis 101,5,64,Kevin Mekulu,2022-07-25
3423,7 Personal Finance Hacks You Must Know,5,70,Mike Toney-Hoffman,2022-07-25
3424,Why Financial Literacy Differentiates You From Either Becoming Rich Or Poor?,4,112,Marcus Tan,2022-07-25
3425,5 Best Personal Finance Books You Must Read To Gain Financial Freedom,4,631,Mofrad Muntasir,2022-07-25
3426,The 3 Best Market Indicators for a Bear Market,7,10,Sanjeeb Basi,2022-07-25
3427,Binance Review & Fees: What Is the Best Crypto Exchange?,11,24,Maximilian Perkmann,2022-07-25
3429,"<strong class=""markup--strong markup--h3-strong"">Now That Bitcoin And Dogecoin Have Failed, Who’s Next? Ethereum?</strong>",3,5,Paulo A. José,2022-07-25
3430,Lean FI,5,171,Nate Meharg,2022-07-25
3433,Inflation Hedge Your Life: 5 Easy Ways to Live Richer,8,21,Matt | Financial Imagineer,2022-07-25
3434,“R” Confirmed?,8,2,Sagar Singh Setia,2022-07-25
3435,Blockchain DIY (1/2),14,82,Technoids Blog,2022-07-25
3436,"<strong class=""markup--strong markup--h3-strong"">Punching Above Your Weight</strong>",6,1,"Olegs Jemeljanovs, PhD, CFA",2022-07-25
3437,"<strong class=""markup--strong markup--h3-strong"">Inflation Down. Risk of Recession Up?</strong>",3,12,Joseph Liebreich,2022-07-25
3439,"<strong class=""markup--strong markup--h3-strong"">How Does The OpenSea Clone Favor In Developing An NFT Marketplace Quickly?</strong>",4,1,Markdomain,2022-07-25
3440,Blockchain has become a foundational technology that enabled new modes of value creation for individuals...,4,60,Samuel Olapade,2022-07-25
3442,Want to Buy more Shares? Do this Now,4,157,Sharyph,2022-07-25
3443,Big earnings week,2,2,Dave Coker,2022-07-25
3445,Why Average Investors Lose Millions In The Stock Market,5,328,Thomas Herold,2022-07-26
3446,Are Recession Fears Making Things Worse? See Who is Cutting Jobs in July,7,700,Alexandre Lores,2022-07-26
3447,Innovation Is Less About Good Ideas Than You Think,7,113,Tavian Jean-Pierre,2022-07-26
3448,Are Markets Efficient?,5,82,Carl Westerby,2022-07-26
3450,"D2C (direct to consumer) Health-tech: How Do We Help, Not Hurt, Our Patients?",4,2,Amit Garg,2022-07-26
3451,5 Reasons Not to Code in Space,3,27,Dylan Cunningham,2022-07-26
3452,Walmart’s margins crater,3,7,Dave Coker,2022-07-26
3453,How Knowing Your Risk Profile Can Help You Build a Stronger Company,5,163,Marianne O,2022-07-26
3454,"Unlocking Innovation with Data, Creativity, and Automation",7,6,Tullio Siragusa,2022-07-26
3455,Trading Plan: 26 July 2022,4,10,Laurentiu Chisca,2022-07-26
3456,Pandemic stocks are done,3,5,Dave Coker,2022-07-26
3457,Avoiding O(n)2 time complexity in Apex Salesforce — (Nested For Loop),3,58,Durvesh Shah,2022-07-27
3458,4 Legit Ways To Earn Cryptocurrencies Without Actually Buying It,4,103,Desiree Peralta,2022-07-27
3459,How To Make a PowerBI Report Look Like A Website?,6,181,Analytic girl,2022-07-27
3460,"<strong class=""markup--strong markup--h3-strong"">Yes, The Next Financial Crisis Is On Its Way. Here is the Origin. But You Shouldn’t Worry About It</strong>",4,13,Paulo A. José,2022-07-27
3461,"Crash-Course: Gradient, Gradient Descent, and Stochastic Gradient Descent",6,575,Stefan Pircalabu,2022-07-27
3462,The 3 Most Important NLP Approaches to FinTech Value Creation,6,11,Anil Tilbe,2022-07-27
3463,How Do Stock Markets Crash?,6,291,Bees & Honey Money,2022-07-27
3465,How to Sell Products/Services to People,4,3,Jerry Keszka,2022-07-27
3467,Another reason not to trade?,3,51,Dave Coker,2022-07-27
3470,Why do you feel poorer?,2,51,Dave Coker,2022-07-27
3471,Inflation Domino: These 6 Countries Could be the Next Sri Lanka,5,392,Sam Warain,2022-07-28
3472,Why Choosing a Career Is So Difficult,6,1,Tavian Jean-Pierre,2022-07-28
3473,Top 10 Essential Deep Learning Models for Financial Engineering,10,37,Anil Tilbe,2022-07-28
3474,Rate Hike Ended Up Bullish,4,60,Ann,2022-07-28
3475,How to Spoof Pokemon GO Location?,4,1,Amit Biwaal,2022-07-28
3476,How to Pick the Best Dividend Stocks — Good vs Bad Stocks,8,163,Sharyph,2022-07-28
3478,So the Economy REALLY is Shrinking. Now What?,3,52,Mike Lukianoff,2022-07-28
3479,"Goodbye Coffee Anxiety, Hello Calming Herbal Brain Booster",4,22,Dean Gee,2022-07-28
3480,Brian Armstrong Says: “ This Is The Number 1 Priority for Startup Founders. Only Do This.”,4,1,Christian Soschner,2022-07-28
3481,Facebook’s Growth Hacking Technique You Should Steal For Your Business,3,59,Mofrad Muntasir,2022-07-28
3482,Ford(F) hits a new 52-week low: Is Ford stock a bargain buy?,3,13,Syam KP | Gulf Brokers,2022-07-28
3483,Blue on blue,6,51,Zorawar,2022-07-28
3484,10 Free Electronic Signature Software 2023 (Tested & Approved),6,5,Toby Kiernan,2022-07-28
3485,Employees Wanting Work to Be Fully Remote Will Win This Fall,8,450,Dr. Gleb Tsipursky,2022-07-28
3486,"<strong class=""markup--strong markup--h3-strong"">Three Resources to Consider to Improve Your Financial Literacy</strong>",2,7,Tunji Onigbanjo,2022-07-28
3487,Hacking emotions: why mental health is so important these days?,2,190,William Barter,2022-07-28
3488,Possible interest rates?,3,2,Dave Coker,2022-07-28
3489,"In Order To Achieve Massive Business Success, Your Life Has To Have a Purpose",4,50,Gil Mahesh,2022-07-28
3490,What To Do If The Business Stagnates (On Which Step Are You?),3,50,Gil Mahesh,2022-07-28
3491,"<strong class=""markup--strong markup--h3-strong"">Money Works Much Better at Night. Many Investors Still Don’t Understand This</strong>",3,256,Paulo A. José,2022-07-29
3492,From Poor Student to Startup CMO in Three Years,9,155,Aure's Notes,2022-07-29
3493,"How Synchronized is Global Economic Growth? GDP Analysis in 5 Chart Types: Line, Heatmap, Boxplot, Ridgeline, Stacked...",8,241,Sabina L,2022-07-29
