,title,reading_time,like,writers,date
4436,Beat the Market with TWTR (Follow Up),3,1,Carl Westerby,2022-09-27
4437,10 Benefits Money Can Offer You,3,54,Destiny S. Harris,2022-09-27
4438,Google’s Myth of Losing Social Capital in Hybrid Work (Video & Podcast),11,328,Dr. Gleb Tsipursky,2022-09-27
4439,5 Important Personal Finance Questions You Should Ask Yourself,5,3,Mohamad Hakim,2022-09-27
4440,"<strong class=""markup--strong markup--h3-strong"">2 Quick Points to Simplify Dollar-Cost Averaging</strong>",2,4,Tunji Onigbanjo,2022-09-27
4441,Open AI CEO Sam Altman Predicts the Next Trillion Dollar AI Company,5,975,Sam Warain,2022-09-28
4442,"It’s Cleaner, Can Lift Off Or Land Anywhere, And Carry Heavy Cargo",6,340,Erik Brown,2022-09-28
4443,Examples of Logical Fallacies in Business and Investments that Can Break You,6,38,Levi Borba,2022-09-28
4444,"Two Twins Hold 70,000 Bitcoin, Making Them the 6th Largest Holders of BTC.",6,62,Jayden Levitt,2022-09-28
4445,Why Did the Costa Concordia Sink?,6,133,KD Writes,2022-09-28
4446,"No, Joe Biden, This Pandemic Isn’t Over. Far From It.",8,177,U-Ming Lee,2022-09-28
4447,Data Exploration & Machine learning on Bigmart Sales Data,10,189,Arun Rajendran,2022-09-28
4448,Top 4 Qualities of Memorable Financial Engineers,6,137,Anil Tilbe,2022-09-28
4449,IKEA’s “Buy With Your Time” Literally Converts Time Into Money — Here’s How,3,342,Mofrad Muntasir,2022-09-28
4450,Think of 100 Digital Products You Can Sell Online For $1,5,106,Fahri Karakas,2022-09-28
4451,Where Will The Stock Market Bottom Out?,3,29,Thomas Ott,2022-09-28
4452,Meta trading at 2019 prices,5,39,Dave Coker,2022-09-28
4453,18 Best FormStack Alternative in 2023 (Free & Paid),15,113,Toby Kiernan,2022-09-28
4454,"Quiet vs Loud Negotiation, Which is Better?",4,54,Dean Gee,2022-09-28
4455,This Week’s Top Cryptocurrency Stories (20–27 SEP ’22),8,516,Stephen Dalton,2022-09-28
4456,Hurricane-omics: A Look into the 10 Costliest Atlantic Storms on Record,5,339,Alexandre Lores,2022-09-28
4457,A rich billionaire who gave away all her wealth,3,146,Aradbranding.Com,2022-09-28
4458,How to Drive Adoption of DeFi With Better Decentralized Oracles,3,62,Marvellous Ugochi Kalu,2022-09-28
4459,The State of Cybersecurity,4,25,Paulina Szyzdek,2022-09-28
4460,Ok Google!,2,23,William Barter,2022-09-28
4461,How To Make Mistakes And Lose In The Right Way?,6,74,Gil Mahesh,2022-09-28
4462,Boardroom Dancing & Deceptions..,5,55,Dean Gee,2022-09-28
4463,THE VALUE OF CANDID CONVERSATIONS IN BUSINESS,4,61,Cesar Keller (CK),2022-09-28
4464,The Market Has Bottomed — Here Is Why,3,298,Lindsay Leeds,2022-09-29
4465,Welcome to The 1970s,3,36,Dave Coker,2022-09-29
4466,Beat the Market with the Manual of Ideas,5,31,Carl Westerby,2022-09-29
4467,"<strong class=""markup--strong markup--h3-strong"">The gifts of a Crypto winter</strong>",4,5,Efi Pylarinou,2022-09-29
4468,Rich Trends: Life Without Death,3,56,Gil Mahesh,2022-09-29
4469,Here is the Valid Roadmap from 0 to a 7-Figure Business,9,49,Christian Soschner,2022-09-29
4470,Blockchain & Healthcare — Where Are We? (Part 2 of 2),3,5,Amit Garg,2022-09-29
4471,"Crypto has Lost Its Way — The Past, Present, and Future",14,86,TobiasMJ,2022-09-29
4472,5 Unusual Ways to Increase Your Net Worth,9,624,Joseph Mavericks,2022-09-30
4473,Why We Need Silence in Our Lives,10,8,Ray Williams,2022-09-30
4474,Data Visualization using Plotly in Python,6,168,Ekemini Okpongkpong,2022-09-30
4475,Guide To Fundamental Analysis for Stock Market Investing with Python,4,91,Asish Biswas,2022-09-30
4476,"The Only Concept You Need to Stop Wasting Your Time Managing Information, Tasks, and Apps",5,53,Paco Cantero,2022-09-30
4477,Creating a New Stochastic Volatility Model from Scratch (Part 1 of 3),8,11,"Ethan Johnson-Skinner, MSc",2022-09-30
4478,"<strong class=""markup--strong markup--h3-strong"">Future of P2E NFT Games in 2023! Bold Predictions Ahead!</strong>",4,11,Scott,2022-09-30
4479,"If You Love Bitcoin but Hate NFTs, You’re Completely Missing the Point",6,9,Jayden Levitt,2022-09-30
4480,"OMG, Revealed! How to Make YouTube Play in the Background?",5,19,Amit Biwaal,2022-09-30
4481,"Terra’s Do Kwon Is Wanted by Interpol, and Yet He is on Twitter",6,50,Napoleon,2022-09-30
4482,"<strong class=""markup--strong markup--h3-strong"">Succeed with the Best Artificial Intelligence Career Plan 2023</strong>",5,116,Jennifer Wales,2022-09-30
4483,Metaverse makes virtual happenings in the hospitality industry,4,13,Allan Jackob,2022-09-30
4484,"<strong class=""markup--strong markup--h3-strong"">Tesla (TSLA) offers far more value than you think</strong>",6,104,Daniel G. Jennings,2022-09-30
4485,Artificial Intelligence and the Metaverse: future terror or present fears?,4,6,Raffaella Aghemo,2022-09-30
4486,Halloween Spending Horror Story,2,69,Dave Coker,2022-09-30
4488,Finding Great Talent when Outsourcing,3,40,Rizwan Qaiser,2022-09-30
4489,How an In-Person Product Event Delivers More Success than Zoom Meetings,7,109,Marianne O,2022-09-30
4490,Remarkably Useful Questions to Ask Yourself to Excel at Life,3,55,Paul Dermody,2022-09-30
4491,Time Series Pattern Matching with Stock Prices,8,85,Riazuddin Mohammad,2022-10-01
4492,S&P 500 wrap up,4,30,Dave Coker,2022-10-01
4493,Introduction to Futures Contracts and the Inter-Market Spread Trading Strategy.,6,30,Dimitrios Gourtzilidis,2022-10-01
4494,"ML News: Best Tools for ML Data Validation, HPO and Inference Endpoints | #02",5,102,Prince Canuma,2022-10-01
4495,The economic impact of the cryptocurrencies,3,10,Crypto Beat,2022-10-01
4496,The World Is a Masquerade!,7,50,Joanne Reed,2022-10-01
4498,Why is Sweden So Rich,6,90,Arsalan Haroon,2022-10-02
4499,A Review of Stable Diffusion with TensorFlow,4,16,Jason Huynh,2022-10-02
4500,A New Era for Passive Income,5,67,KD Writes,2022-10-02
4501,5 Hard Truths about Money that will Make You Re-evaluate your Finances,5,196,Desiree Peralta,2022-10-02
4502,Can Blockchain Technology Revolutionize Healthcare?,8,134,Marlon Weems,2022-10-02
4503,How to Build Wealth,4,64,Dave Coker,2022-10-02
4504,How To Find And Amplify Your Zone of Genius,14,11,Fahri Karakas,2022-10-02
4505,Are You Spending More in 2022?,6,449,Gayle Kurtzer-Meyers,2022-10-02
4506,How Data Science Came to Be,5,3,Rijul Singh Malik,2022-10-02
4507,The Crumbling Story of Pound Sterling,3,51,Rabinder Kumar,2022-10-02
4508,Penny for Your Thoughts,5,450,Sudipto Chanda,2022-10-02
4509,Europe Going Nuclear,4,279,Mike Hassaballa,2022-10-02
4511,Five Tips If You Want To Get Into A Company That Has Already Turned You Down,4,51,Gil Mahesh,2022-10-02
4512,Rob Kiyosaki’s Bitcoin Message to Millennials Has a Greater Impact on You Than His Book,8,604,Jayden Levitt,2022-10-03
4513,How does October usually play out in the financial markets?,4,7,Piotr Szymanski,2022-10-03
4514,"<strong class=""markup--strong markup--h3-strong"">How Many Blogs Should You Run?</strong>",4,416,Official Djangonaire,2022-10-03
4516,Crypto Credit Cards — A Financial Innovation,3,1,Crypto Beat,2022-10-03
4517,Overwhelming Brutal Truths Bitcoin Holders Must Accept,6,356,Jayden Levitt,2022-10-04
4518,"UK Near Collapse, Who’s Next.",5,148,Carlos Pascual,2022-10-04
4519,20 Ways To Save 100K,3,68,Destiny S. Harris,2022-10-04
4521,The Truth About Work From Home Productivity,11,186,Dr. Gleb Tsipursky,2022-10-04
4522,Adobe (ADBE) has Fallen 60% — Should You Buy it Now?,7,23,Sriram Balasubramanian,2022-10-04
4523,Beat the Market with Graham Style Investing,5,11,Carl Westerby,2022-10-04
4524,How To Make $900+ on Pinterest (2 EASY WAYS!),5,18,KD Writes,2022-10-04
4526,"<strong class=""markup--strong markup--h3-strong"">Should we ban Airbnb (ABNB)?</strong>",6,62,Daniel G. Jennings,2022-10-04
4527,"China’s Economy ‘Dismal,’ Will See No Growth, New Report",2,35,Simon Constable,2022-10-04
4528,To Build Wealth Invest Globally,4,29,Dave Coker,2022-10-04
4529,Start Your Ideal Blog in 30 Minutes,5,97,Jason Huynh,2022-10-04
4530,This 1 Thing Helped Me Improve My Financial Health,4,365,Marichelle E. Urquico,2022-10-04
4531,British Currency Mess Set To Upend U.K.’s Housing Market,2,33,Simon Constable,2022-10-04
4532,7 Worst (And Common) Money Mistakes to Avoid,3,115,Mofrad Muntasir,2022-10-04
4533,"What Is A Bond, How To Calculate Bonds Return, And More",4,1,Ajay Singh,2022-10-04
4534,U.K. ‘Mini Budget’ Likely Just Dealt Scotland A Fiscal Time Bomb,3,2,Simon Constable,2022-10-04
4535,Stock Market Update: Investors Turn to Job Reports and PMI Data For Signs of Economy Recovery,3,50,ARTInvest,2022-10-04
4536,"<strong class=""markup--strong markup--h3-strong"">An Industry Classification Standard to Know About</strong>",2,5,Tunji Onigbanjo,2022-10-04
4537,3 Salary Negotiation Mistakes to Avoid,3,50,Gil Mahesh,2022-10-04
4538,70% Of People Continue To Work On Vacation: How Not To Become One Of Them,4,50,Gil Mahesh,2022-10-04
4539,Could we possibly see even worse economic conditions?,4,33,Passiveblog,2022-10-04
4540,What makes a data-driven leader?,2,2,Priyanka Roy,2022-10-04
4541,A frog in an egg or the story of reincarnation...,3,176,Aradbranding.Com,2022-10-04
4544,10 Smart Websites Powered by AI That Will Make Your Jaw Drop,5,531,Jerry Keszka,2022-10-05
4545,Chamath Palihapitiya: The Stock Market Bottom Is Near — “Time To Start Nibbling”,5,533,Sam Warain,2022-10-05
4546,One Year Busking and This is What I Learnt,10,144,Wellyington,2022-10-05
4547,5 Imaginative Data Science Projects That Can Make Your Portfolio Stand Out,6,93,Ken Jee,2022-10-05
4548,"You Will Buy Crypto at Higher Prices, But Not Today",6,286,Mark Helfman,2022-10-05
4549,Create and Modify Excel File Using Python,8,9,Almas Myrzatay,2022-10-05
4550,We are NOT seeing “dot com” bubble 2.0,3,146,Dave Coker,2022-10-05
4551,Arbitrum — Big winner of Layer-2s in 2022?,6,16,Henrique Centieiro,2022-10-05
4552,7 Magic Habits That Will 10x Your Productivity and Creativity,12,5,Fahri Karakas,2022-10-05
4553,When Insurance Doesn’t Mean What You Think It Does,4,487,William Spivey,2022-10-05
4554,"When You Have Money, You Can Live However You Want",3,67,Destiny S. Harris,2022-10-05
4555,Elon Musk ́s secret weapon,2,185,Eduardo Remolins,2022-10-05
4557,Why You Should Invest In Really Niche Companies,6,40,Jason Huynh,2022-10-05
4558,Please Take a Moment to Forget the Economy,7,61,Peter McClard,2022-10-05
4559,I Got a 12-Hour Twitter Ban for Hate Speech,5,352,Joshua Gane,2022-10-05
4560,What is A CRO vs a CEO? A Secret Weapon of Global Corporations,4,3,Dean Gee,2022-10-05
4561,The importance of quantum computers,6,1,Cornelius Schätz,2022-10-05
4562,3 Habits Will Make You Poor,3,59,Saurabh Adhane,2022-10-05
4563,“Quiet Quitting” Might End Up Glorifying Hustle Culture (The Practice It Wanted to Avoid),3,205,Mofrad Muntasir,2022-10-05
4564,3 Reasons Behind Crypto Market’s Volatility,4,9,Sam Maiyaki,2022-10-05
4565,Your Income Is The Average of The 5 People Closest To You,3,3,Destiny S. Harris,2022-10-05
4566,Blockchain Development Solutions Advances The Digital World Growth,5,96,Lucas Andrew,2022-10-05
4567,Should You Return To Your Old Job? Six Tips To Help You Decide,4,1,Gil Mahesh,2022-10-05
4568,What’s The Problem? UK Economic Policy Mirrors Successful 1980s U.S. Effort,2,20,Simon Constable,2022-10-05
4569,Economic Immunity Is Possible: 10 Strategies,3,56,Destiny S. Harris,2022-10-05
4572,Best Penny Stocks To Buy Now? 4 Under $4 To Watch Today,5,11,Joe Sirianni,2022-10-05
4574,Expected Inflation is Falling,2,12,Dave Coker,2022-10-06
4576,FinTech Startup Ideas to Watch Out for in 2022 | Ronas IT,9,873,Ronas IT,2022-10-06
4577,You Don’t Have a Bitcoin Problem; You Have a Problem Accepting Change.,5,154,Jayden Levitt,2022-10-06
4578,Beat the Market with Rule Number 1,7,31,Carl Westerby,2022-10-06
4579,Powerful Women Inspire Many People to Follow Their Lead,8,127,Jim Katzaman - Get Out of Debt,2022-10-06
4580,The Most Important Quotes about AI,6,374,Stefan Pircalabu,2022-10-06
4581,How blockchain technology (can) contribute to carbon neutrality,5,58,Quantum,2022-10-06
4582,Things To Do Before You Retire,3,60,Marcus Tan,2022-10-06
4584,"A Primer on Medicare Advantage, Risk Sharing, Capitation, and Value Based Care",5,28,Amit Garg,2022-10-06
4585,Guide on controlling your emotions while trading on the stock market.,3,160,Paul Blazejewski,2022-10-06
4586,5 Interesting events in the Metaverse that might lure the audience,4,20,Allan Jackob,2022-10-06
4587,Web Data: Structured Vs. Unstructured,6,48,Bright Data,2022-10-06
4588,"<strong class=""markup--strong markup--h3-strong"">Refine yourself with Law.</strong>",8,394,Hardik Jain,2022-10-06
4589,In a Tweet How Do You Sum up the Twitter Elon Musk Drama,5,46,Napoleon,2022-10-06
4590,Why Imposter Syndrome Is Good for You,6,79,Upen Singh,2022-10-06
4591,Being Indispensable,3,169,David August,2022-10-06
4593,Random Forests and Boosting for ARCH-like volatility forecasts,8,14,Sarem Seitz,2022-10-07
4594,What is retail money doing?,3,89,Dave Coker,2022-10-07
4595,"<strong class=""markup--strong markup--h3-strong"">Will Apple (AAPL) Collapse?</strong>",6,11,Daniel G. Jennings,2022-10-07
4596,I Interviewed One of Meta’s AI Systems,5,51,Arthur Mello,2022-10-07
4598,Find out the 20 most entrepreneurial cities in Europe in 2022,4,22,Thomas Vato,2022-10-07
4599,How to Understand Visible and Invisible AI,3,63,Thomas Vato,2022-10-07
4600,Can art save NFT’s?,5,3,Erman Akdogan,2022-10-07
4601,4 Important Areas Where AI Will Benefit You,4,1,Thomas Vato,2022-10-07
4602,Your work matters.,2,1,Carolyn,2022-10-07
4603,What’s Trending: College Radio Troubles,3,1,Jaci Clement,2022-10-07
4604,You Must Look Closer at Ethereum Before It’s Too Late — Environmental Excuses Are Over.,5,392,Jayden Levitt,2022-10-08
4605,How to Run Zipline Backtesting in 2022,8,23,Jonas Schröder,2022-10-08
4606,Will Artificial Intelligence Dominate Trading?,4,28,Dave Coker,2022-10-08
4607,Cheers to Us!,4,114,Utkarsha Malkar,2022-10-08
4608,Why this crypto bottom is the best time to buy,4,35,Passiveblog,2022-10-08
4609,How to Earn Passive Income with Bitcoin,3,1,Crypto Beat,2022-10-08
4610,Bitcoin And Stock Correlation Reveals Secrets,3,1,Crypto Beat,2022-10-08
4611,Crypto Investments Belong in Your Retirement Plan,3,7,Crypto Beat,2022-10-08
4612,A Simple Technical Indicator to Find Stocks Outperforming the Market,7,83,Danny Groves,2022-10-09
4613,Someone believes that the VIX index will reach 150 by March 2023.,5,26,Piotr Szymanski,2022-10-09
4614,"Fan Tokens are Pumping: +1,000% (60 days)",5,13,Richard Knight,2022-10-09
4615,Machine learning for non-ML experts,7,6,Rijul Singh Malik,2022-10-09
4616,How to Analyze Company Data with Yahoo Finance Like A Stockmarket Oracle,6,86,Jason Huynh,2022-10-09
4617,News Article Generation from Youtube Video Clips,4,11,Andreas Stöckl,2022-10-09
4618,The Boom Bust Cycle and how it affects tech,10,10,Devansh- Machine Learning Made Simple,2022-10-09
4619,Beat the Market with HPQ?,6,33,Carl Westerby,2022-10-09
4620,"<strong class=""markup--strong markup--h3-strong"">The Metaverse — A Revolution In Gaming</strong>",4,33,James Anders,2022-10-09
4621,"<strong class=""markup--strong markup--h3-strong"">Reasons Why People Are Not Rich Even if They Own Businesses</strong>",4,192,Dennis De Silva,2022-10-09
4622,Tesla is Probably Overvalued and Other Conclusions...,6,1,Mats Larsson,2022-10-09
4623,To select a winning stock,3,19,Dave Coker,2022-10-09
4624,"Beyond Industry 4.0, Digital Will Reshape Our Society",6,1,Flavio Aliberti,2022-10-09
4625,The Dollar War,3,92,Mike Hassaballa,2022-10-09
4627,Financing A Car Creates An Illusion Of Wealth,4,54,Destiny S. Harris,2022-10-09
4628,Beating the Stock Market is Like Being a Top MotoGP Racer,6,55,B. Wright,2022-10-09
4629,What does the future look like with digital wallets?,3,9,Jan,2022-10-09
4631,Automating Technical Analysis for Stock Trading With Python,7,39,Riazuddin Mohammad,2022-10-10
4632,What is a Web Crawler? And How Web Crawler works?,10,8,Animesh Gaitonde,2022-10-10
4633,Creating a New Stochastic Volatility Model from Scratch (Part 2 of 3),6,5,"Ethan Johnson-Skinner, MSc",2022-10-10
4634,Inside the Mind of Nassim Taleb. How to Invest Differently,6,9,Jason Huynh,2022-10-10
4635,Elon Musk Involved in Alleged Pyramid Scheme —Says He’s Doing It for the People.,6,52,Jayden Levitt,2022-10-10
4636,"<strong class=""markup--strong markup--h3-strong"">Will Venezuela Oil Deal boost Chevron (CVX)?</strong>",5,3,Daniel G. Jennings,2022-10-10
4637,5 Numbers To Watch Before Investing Your Money,5,76,Asish Biswas,2022-10-10
4638,5 Simple Steps to Research Any Stock,5,10,Sharyph,2022-10-10
4640,Shockingly Irresponsible Fed Policy Will Cause a Global Recession,4,86,Michael Busler,2022-10-10
4641,More Stock Overnight Returns,6,200,Giovanni Valdata,2022-10-10
4642,Summary of the book Swallow Your Frog,8,161,Aradbranding.Com,2022-10-10
4644,Look at The European Banking Sector,2,7,Dave Coker,2022-10-10
4646,"Stock Market Update: Inflation, Retail Sales, and Bank Earnings Will Drive Markets in The Week Ahead",4,10,ARTInvest,2022-10-10
4647,Different Business Model Types,3,10,Kevin Gabeci,2022-10-10
4650,Why I invest in Art,3,31,Paulina Szyzdek,2022-10-10
4651,Metaverse goes high with every application adapting its virtual reality,4,51,Allan Jackob,2022-10-10
4652,The Ultimate Beginner’s Guide to Cryptocurrency Wallet,4,52,Abimbola Abe,2022-10-10
4653,Top 5 Reasons Why Bitcoin Will Last,3,51,Crypto Beat,2022-10-10
4657,8 Free Websites That Will Get You to The Top 1 % of Everyone,4,484,Jerry Keszka,2022-10-11
4658,The Impact of Rising Interest Rates on Monthly Loan Payments,3,11,Thomas Guenter,2022-10-11
4659,Are dividend ETFs worth it?,4,8,Gianluca Malato,2022-10-11
4660,Inflation and Stock Valuations,9,1,Riazuddin Mohammad,2022-10-11
4661,Unlikely Crypto Investing Lessons You Can Learn From Glauber Contessoto,4,4,Jayden Levitt,2022-10-11
4662,Divergent And Convergent Thinking: What Is It And How Is It Useful In Work?,5,24,Gil Mahesh,2022-10-11
4663,Q3 Earnings Season Starts This Week,3,33,Dave Coker,2022-10-11
4664,Design coordination is easy way to simplified in construction works,5,2,Manikandan,2022-10-11
4666,"<strong class=""markup--strong markup--h3-strong"">The One Thing You Can Do To Overturn a Job Rejection</strong>",3,102,Dennis De Silva,2022-10-11
4667,Love and Coaching Book Launch,3,6,Emily,2022-10-11
4668,Women Work More But Earn Less: How To Overcome It?,6,1,Gil Mahesh,2022-10-11
4671,7 Best Books on the Science of Learning,9,250,Scott H. Young,2022-10-12
4672,3 Greatest Enemies of Success,4,6,Dean Gee,2022-10-12
4673,Now Bitcoin and Ethereum Are Establishing Themselves — Here’s Your Next Best Cryptocurrency Opportunity.,5,119,Jayden Levitt,2022-10-12
4674,"Play To Earn Gaming Economy, Market Size and Business Model",7,12,Lucky Brian,2022-10-12
4675,Why This Country in Africa Is Growing So Fast?,6,64,Levi Borba,2022-10-12
4676,Does Bitcoin have a role in a New Macroeconomic Era?,8,66,Patrick Tan,2022-10-12
4677,ETH supply just turned deflationary... All because of this!?,5,45,Henrique Centieiro,2022-10-12
4678,Fantasy EPL GW10 Recap and GW11 Algo Recommendations,11,4,Dilyan Kovachev,2022-10-12
4679,Teleportation — Why it is important for the future of communication,8,35,Cornelius Schätz,2022-10-12
4680,"<strong class=""markup--strong markup--h3-strong"">Web3 Game Solutions — The Next Gaming Trend</strong>",5,51,Lucas Andrew,2022-10-12
4681,Why is The Dollar So Strong?,3,103,Dave Coker,2022-10-12
4682,"<strong class=""markup--strong markup--h3-strong"">“When Sadness Finds You”</strong>",5,68,Utkarsha Malkar,2022-10-12
4683,Brain Missing Alert! Elon Musk’s Optimus,4,583,Stefan Pircalabu,2022-10-12
4684,"The $Trillion Race For The Arctic, That Could Change The World",3,9,Dean Gee,2022-10-12
4685,Communication Barriers: The Most Common Communication Mistakes,6,1,Gil Mahesh,2022-10-12
4686,"<strong class=""markup--strong markup--h3-strong"">Five Most-preferred Investment Models in the Blockchain World Now!</strong>",4,13,Scott,2022-10-12
4688,Good SEO Can Be Cheap,3,1,Jason Aro,2022-10-12
4691,I Never Invested in the Stock Market Until I Understood This,10,882,Joseph Mavericks,2022-10-13
4692,Build your own fully automated market maker,6,42,Deephaven Data Labs,2022-10-13
4693,3 Bargain Cryptocurrencies You Should Add Now to Master the Next Bull Run,7,345,Stephen Dalton,2022-10-13
4694,5 Youtube Channel That Will Teach you Data Science,6,183,Gencay I.,2022-10-13
4695,"<strong class=""markup--strong markup--h3-strong"">Quant (QNT) a Cryptocurrency for Big Finance</strong>",3,25,Daniel G. Jennings,2022-10-13
4696,What is Your Circle of Competence?,5,15,Carl Westerby,2022-10-13
4697,"As a Startup Founder, Never Ever Confuse Equity With Cash",6,21,Christian Soschner,2022-10-13
4698,Why Your Degree Doesn’t Really Matter? Do This Instead,4,20,Marcus Tan,2022-10-13
4699,3 Ways to Grow Your Money In Yet Another Recession,6,10,Reza Kunimoto,2022-10-13
4700,"Is There Life After Capitalism: Happy Post-Capitalism, Communism, Scarcism, or MadMaxism?",4,21,"Olegs Jemeljanovs, PhD, CFA",2022-10-13
4701,Being The Dumbest Person in the Room is Underrated.,3,77,Miyah Byrd,2022-10-13
4702,September CPI Comes In Hot,3,7,Dave Coker,2022-10-13
4703,Hopes of Peak Inflation Dashed,2,41,Mike Lukianoff,2022-10-13
4705,The Coming American Retirement Crisis,7,450,Armchair Banker,2022-10-14
4706,Optimized “920 Straddle Strategy” To Get More Than 80% Return Annually,3,107,Amit Kumar Gond,2022-10-14
4707,"<strong class=""markup--strong markup--h3-strong"">How to Stop Having All Your Digital Information Scattered All Over the Place</strong>",5,193,Paco Cantero,2022-10-14
4708,FOMC Decision November 2nd,4,10,Dave Coker,2022-10-14
4709,"<strong class=""markup--strong markup--h3-strong"">Will the Restaurant Labor Shortage Destroy McDonald’s (MCD)?</strong>",8,50,Daniel G. Jennings,2022-10-14
4710,"<strong class=""markup--strong markup--h3-strong"">Facebook &amp; Instagram’s Struggles Continue As Their Reputation Suffers Among Content Creators</strong>",5,389,Joe Duncan,2022-10-14
4711,Will the Fed Keep Raising Rates: And Will This Hurt My Portfolio?,5,555,Alexandre Lores,2022-10-14
4712,11 Most Creative Cities in The World,3,72,Thomas Vato,2022-10-14
4713,"<strong class=""markup--strong markup--h3-strong"">I Don’t Believe in Financial Freedom. You Shouldn’t Either</strong>",5,11,Paulo A. José,2022-10-14
4714,Payments Overview,8,10,David Doherty,2022-10-14
4715,Howard Shultz’s Recent Move Into Blockchain Technology Is the Most Important in History,5,118,Jayden Levitt,2022-10-14
4716,How to select a winning stock,4,11,Dave Coker,2022-10-14
4717,Flat is the new up,2,122,Jess Schram,2022-10-14
4718,Gale Courses: Free Live Courses Taught by Actual Instructors on Just About Any Subject,4,50,Robin Nemesszeghy,2022-10-14
4720,I Gave a Homeless Man $10. He Gave Me Something Worth So Much More,3,116,Paul Dermody,2022-10-14
4721,Online resources that help you embrace Venture Capital,8,20,Paulina Szyzdek,2022-10-14
4724,“Counteroffer”: Should It Be Accepted?,4,11,Gil Mahesh,2022-10-14
4725,I Was Asked How a Man Knows if He Is Ready To Be a Dad,3,50,"Jessica Lyon & Joshua J. Lyon, BSQP, CNP (J & J)",2022-10-14
4726,Without a Scratch,3,9,William Barter,2022-10-14
4727,A Simple Option Trading Strategy With 98% Win Rate,3,312,Amit Kumar Gond,2022-10-15
4728,Mike Novogratz — Billionaire Investor Tells You How Long the Bitcoin and Crypto Bear Market Will Last,4,421,Jayden Levitt,2022-10-15
4729,Sorry Economic Doomsters,3,62,Dave Coker,2022-10-15
4730,CMOs Are Not Happy with their Digital Marketing... No Sh*t!,5,43,Cesar Keller (CK),2022-10-15
4731,How to Invest in a Bear Market,5,26,Sharyph,2022-10-15
4732,"<strong class=""markup--strong markup--h3-strong""><em class=""markup--em markup--h3-em"">My 5 takeaways from “The Culture Map” by Erin Meyer</em></strong>",6,33,Aigerim Shopenova,2022-10-15
4733,"<strong class=""markup--strong markup--h3-strong"">A brief on Natural Language Processing(NLP)</strong>",3,78,Dwarf AI,2022-10-15
4734,Manipulation in the 21st Century,3,25,Jasper Ruijs🚀,2022-10-15
4735,International Value Investing,8,59,The Gift Of Fire,2022-10-16
4736,How to Start a Career in Data Engineering,6,33,Rijul Singh Malik,2022-10-16
4737,20 Finance Tips,3,25,Destiny S. Harris,2022-10-16
4738,"<strong class=""markup--strong markup--h3-strong"">Future of Artificial Intelligence</strong>",6,87,Amit Chauhan,2022-10-16
4739,7 Tezos NFT Marketplaces You Should Know,8,29,Christian Jensen,2022-10-16
4740,Creating an e-commerce bot to buy online items with ScrapingBee and Python,9,59,Adnan Siddiqi,2022-10-16
4741,"Farewell & Thank You, Al Ries — The Father of Brand Positioning",3,163,Mofrad Muntasir,2022-10-16
4742,Why you need to diversify,3,71,Dave Coker,2022-10-16
4744,Investing Ain’t Easy,8,71,Michael Cascio,2022-10-16
4745,Digging Enchanting Rabbit Holes,10,22,Peter Avritch,2022-10-16
4746,Earn $600+ Making Content for Your Business,4,40,KD Writes,2022-10-16
4747,8 Actions That Helped Me Pay Off My Parent Plus Loan,4,28,Destiny S. Harris,2022-10-16
4748,How (And Why) I’m Reintegrating With Social Media After Living For Years Without It,7,118,Meg B.,2022-10-16
4749,"How Twitter Could Be Better Monetized, The Sequel",3,41,Dave Rauschenfels,2022-10-16
4750,Don’t Allow Your S/O To Manage All The Money,3,63,Destiny S. Harris,2022-10-16
4751,How to Predict Stock Volatility Using GARCH Model In Python,5,39,Khuong Lân Cao Thai,2022-10-17
4752,Supercharge Technical Analysis with Machine Learning,10,60,Riazuddin Mohammad,2022-10-17
4753,"The Secrets of Stealth Wealth: How to Live a Bigger, Better Life",15,257,Matt | Financial Imagineer,2022-10-17
4754,"Ethereum 2.0 Merge: Price, Impact & Outlook",6,33,Maximilian Perkmann,2022-10-17
4755,How to Write Articles That Will Get Your Audience Hooked,6,100,Jason Huynh,2022-10-17
