,title,reading_time,like,writers,date
0,The Father of Value Investing and his Best Disciple: The Story of Benjamin Graham and Warren Buffett.,4,6,Dimitrios Gourtzilidis,2022-01-01
1,Should You Buy Coffee Every Day?,6,111,Matthew Chin,2022-01-01
2,4 Experts (Not Influencers) Who Can Teach You About Crypto — Part 2,6,74,Geeta Anjali,2022-01-01
3,Adam Smith: The Father of Economics.,5,1,Dimitrios Gourtzilidis,2022-01-01
4,The End of Conglomerated Social Networks: The Public Hypercloud,8,4,Peter McClard,2022-01-01
6,The Story of a Great Depression.,5,26,Dimitrios Gourtzilidis,2022-01-01
7,"Domain Extension No Longer Matters, Stop Spending a $1,000,000 on a Domain",4,10,Clement Brian,2022-01-02
8,I Found the Best Financial Education Channel on YouTube,4,33,Dylan Hughes,2022-01-02
9,Getting rich by following technical trends,5,111,Crypto Beat,2022-01-02
10,"How Much I Made with 4,000 Views",3,11,Mohamad Hakim,2022-01-02
11,Why I’m Becoming More Debt Averse,4,309,Nate Meharg,2022-01-02
12,"Bitcoin, other cryptos, end the year on a down note",3,55,Shefali O'Hara,2022-01-02
13,How to Evaluate a Cryptocurrency,11,202,Richard Knight,2022-01-03
14,5 Reasons Why You Should Get The iPhone 13 Mini In 2022,6,55,Benny Lim,2022-01-03
15,The Greatest Predictor of Your Financial Success,6,1000,Tim Denning,2022-01-03
16,Mathematical Guide to Modelling the Distribution of Asset Returns,11,95,"Ethan Johnson-Skinner, MSc",2022-01-03
17,Is HI.com a Legitimate Way to Earn Passive Income? (Up to 100$ Daily),6,53,Maximilian Perkmann,2022-01-03
18,Is Snowflake Expensive?,4,140,John Thuma,2022-01-03
19,Worldly Wisdom for 2022,13,7,David R. Phillips,2022-01-03
20,Chinese Warren Buffett’s 6 Core Values,4,121,Carlos Pascual,2022-01-03
22,The Metaverse: The 8 Key Technology Drivers,6,48,Nitin Kumar,2022-01-03
23,"<strong class=""markup--strong markup--h3-strong"">How To Become A Successful Crypto Investor Without Learning The Nitty-Gritties Of Trading</strong>",11,66,ngugi,2022-01-03
24,A Crypto Idea That Seeks to Solve Global Warming,3,284,Kit Campoy,2022-01-03
25,Idle Mystic IMT Listing on Pancake Swap DEX,2,34,Geoffrey Gardiner,2022-01-03
26,PUGG: a decentralized metaverse built and supported by BSC,5,338,Adria Parcerisas Albés,2022-01-03
27,A Recipe to improve your Sales Skills,6,56,Pierre Gaubil,2022-01-03
28,Overrated? Data and Candy Corn Examined,5,3,Michiko Wolcott,2022-01-03
29,Conversations That Matter Add Value and Benefit Each Person,7,1,Jim Katzaman - Get Out of Debt,2022-01-03
30,4 questions to ask yourself before accepting the job?,2,122,Ons Bouneb,2022-01-03
31,2022: A year in view.,6,8,Cryptocurrency Scripts,2022-01-03
34,Cloud Computing in Today’s Corporate Era,4,2,Emily Daniel,2022-01-03
35,How to Create an NFT Marketplace Website?,10,123,Lucas Andrew,2022-01-04
36,KlimaDAO: DeFi Backed by Carbon Credits,10,2,Illogical Concept,2022-01-04
37,"Inflation Is Not a Bug, It’s a Feature",5,23,Thomas Herold,2022-01-04
38,FIRE Movement Meet Workers Revolt,10,137,Mackenzie Andersen,2022-01-04
39,5 Genius Ways To Use Fiverr as a Content Creator,5,652,Christopher Kokoski,2022-01-04
40,Why Lumber Won’t Boom In 2022,2,12,Simon Constable,2022-01-04
41,My Passive Income Rose 500% Last Year,3,8,Thomas Ott,2022-01-04
42,How to Lead by Example,5,57,Tavian Jean-Pierre,2022-01-04
43,PAF DAO: next evolution in DeFi,3,276,Adria Parcerisas Albés,2022-01-04
44,How to Define a ‘Good Time’ to Buy Crypto-Currencies,4,15,Saurabh Adhane,2022-01-04
46,Don’t be Sold when Selling your Home,3,250,Brian Dickens Barrabee,2022-01-04
47,Savings Alone is Not Enough,4,51,Mohamad Hakim,2022-01-04
48,Key reasons which Fueled the record growth of cryptocurrencies in 2021?,4,14,Rashmeet Kaur,2022-01-04
51,"<strong class=""markup--strong markup--h3-strong"">Why is Data Science Losing Its Charm?</strong>",4,40,Albert Christopher,2022-01-05
52,15 Reasons Why You Should Own Bitcoin in 2022,7,102,Ras Vasilisin,2022-01-05
53,It’s How Artificial intelligence Can Prevent Future Data Breaches,9,8,Mariojose Palma,2022-01-05
54,What Will End This Crypto Bull Cycle?,5,202,Pavle Marinkovic,2022-01-05
55,Women hold only 24% percent of c-suite roles in Tech.,5,117,Samantha Lewis,2022-01-05
56,Blockchain Simulator: What is it and how is it built?,3,15,Rashmeet Kaur,2022-01-05
57,The Future of Clinical Trials Belongs to Blockchain Technology,7,52,Renato Zamagna,2022-01-05
58,3 Tested Ways To (Actually) Control Your Emotions And React Better,5,50,Bernie E. Robert,2022-01-05
59,A Happy Internet Is Waiting for You,4,573,Carmen Ballesteros,2022-01-05
60,Again... Reflect and Take Care of Yourself,3,119,Zeina Dagher,2022-01-05
62,You Won’t Believe What Google Is Doing...,2,1,slashdotted,2022-01-05
63,LiDAR: 3D Perception and Object Detection,8,96,Xavier Rigoulet,2022-01-06
64,No Whiteboard: Hiring Companies That Don’t Require a Coding Test,3,6,Zach Quinn,2022-01-06
65,"Centralization Took Us Here, Cryptocurrencies Will Take Us There",7,57,Patrick Tan,2022-01-06
66,Web3 is a Mess. Why This is Good.,5,9,Giles Crouch | Digital Anthropologist,2022-01-06
67,How Kiyosaki’s Wisdom on “Rich Dad Poor Dad” Will Change How You View Money,6,3,Marcus Tan,2022-01-06
68,You Do Not Need to Motivate People to Work,5,19,Tavian Jean-Pierre,2022-01-06
69,6 Reasons Why Your PKM Should Be a Fun Thing,2,14,Paco Cantero,2022-01-06
70,Can Centene make money from Medicaid? — Market Mad House,5,3,Daniel G. Jennings,2022-01-06
71,Crypto And Gaming Are A Match Made In Heaven,7,1,Richmore Capital,2022-01-06
73,What’s Trending in Media 2022,4,1,Jaci Clement,2022-01-06
74,"The roles of VR, AR and MR on the Metaverse",7,122,Henrique Centieiro,2022-01-07
75,"No, Your House Is Not an Asset",6,263,Jerren Gan,2022-01-07
76,The Graph: The Decentralized Google For Blockchains,8,50,Maximilian Perkmann,2022-01-07
77,IKEA Powerful Marketing Strategy,4,92,Maryam,2022-01-07
78,Why Most People Will Never Achieve Financial Freedom,7,341,Lauren Como,2022-01-07
79,Are we in a Cryptocurrency Bear Market?,4,14,Mohamad Hakim,2022-01-07
80,Best White Label Crypto Exchange Software 2022,4,251,Lucas Andrew,2022-01-07
81,How You Can Practice Time Blocking Without a Calendar in Your PKM,2,26,Paco Cantero,2022-01-07
82,"<strong class=""markup--strong markup--h3-strong"">From 2021 to the future: Past year’s ten most significant economic questions, that only time will answer</strong>",8,18,John V. Krompas,2022-01-07
83,3 Things You Need To Know Before Buying a Property in Switzerland,6,81,yasi,2022-01-07
84,Decentralized Finance (DeFi),4,47,Keerat Singh Khurana,2022-01-07
86,Want to Know What Your Boss or Colleague Earns? Be Careful What You Wish For,5,2,Alan Morantz,2022-01-07
89,Machine Learning Only Exists With Human Teaching,2,7,Juliano Statdlober,2022-01-07
91,Businesses Hope to Start Fresh with the Dawn of a New Year,7,4,Jim Katzaman - Get Out of Debt,2022-01-07
92,6 Classics Every Data Scientist Should Read in 2022,6,474,Arthur Mello,2022-01-08
93,This Tiny Decision Transformed My Financial Future,4,1300,Tim Denning,2022-01-08
94,What Will The Year 2022 Be for Cryptocurrency,8,546,Ann,2022-01-08
95,Is Terra (LUNA) A Good Investement?,7,124,Pavle Marinkovic,2022-01-08
96,Late Sensor Fusion: 3D and 2D Object Detection for Self-Driving Cars,5,10,Xavier Rigoulet,2022-01-08
97,How to switch from a 9 to 5 to self employed,4,9,Passiveblog,2022-01-08
98,"One Trait Crucial For Success, From a Chinese Billionaire",5,1,Dean Gee,2022-01-08
99,21 Fun Facts About Crypto,3,801,Alexandre Lores,2022-01-09
100,5 Things You’ll Stop Doing When You’re Seriously Ready to Change Your Life,9,968,Ayodeji Awosika,2022-01-09
101,"How to Avoid Stress and Anxiety? By Being Hopeful, Grateful, and Mindful.",6,599,Joanne Reed,2022-01-09
102,New Law Goes Into Effect Giving Students Five Excuses Absences for Mental Health Days Without a Doctor’s Note,6,30,"Natalie Frank, Ph.D.",2022-01-09
103,Blockchain And Election System,5,6,Tarulika Jain,2022-01-09
104,Query Microsoft Active Directory using SQL Server,2,1,Ganesh Chandrasekaran,2022-01-10
107,Plotting your IPO journey — A Human Capital Perspective,7,1,Finney Thomas,2022-01-10
109,Can Ambire AdEx (ADX) Make money from Advertising? — Market Mad House,4,50,Daniel G. Jennings,2022-01-10
110,2021 — the year of the staycation,2,1,Priyanka Roy,2022-01-10
111,"<strong class=""markup--strong markup--h3-strong"">Improving Efficiency and Management in the Automobile Industry using Blockchain Technology</strong>",4,9,Rashmeet Kaur,2022-01-10
112,The 3 Strangest Unsolved Disappearances of All Time,6,336,KD Writes,2022-01-11
113,The Web3 / Metaverse Glossary — A Keyword Guide to the Tech Future,14,136,Kenneth Leung,2022-01-11
114,10 Hidden Challenges that Business Analysts Face,9,54,Rijul Singh Malik,2022-01-11
115,Do not Invest in Airlines: Here is Why,5,18,Ardi Aaziznia,2022-01-11
116,10 Tips to Writing Better ESG Reports,7,16,Americana Chen,2022-01-11
117,The Man Who Claims He Mines Up To $800 Monthly in Ethereum With His Tesla,4,81,Andrew Martin,2022-01-11
118,Key Benefits of Warehouse Management System (WMS),7,5,Maja Dakić,2022-01-11
120,The Workflow and Apps You Need to Move from Complex Ideas to Concrete Action Items,2,101,Paco Cantero,2022-01-11
121,Why Humble Leadership Is the Best Leadership,5,33,Tavian Jean-Pierre,2022-01-11
122,"<strong class=""markup--strong markup--h3-strong"">Short.</strong>",2,622,Balpolam Idi,2022-01-11
123,7 Finance Tips from a Single Mom,7,65,Caroline P.,2022-01-11
124,"<strong class=""markup--strong markup--h3-strong"">2022 Outlook: A Year of Change</strong>",7,51,ReturnBoost,2022-01-11
125,My Advice to New Investors: Lose Money,4,158,David Fraser,2022-01-11
126,Will Bitcoin Boom in 2022?,4,47,Shefali O'Hara,2022-01-11
127,"<strong class=""markup--strong markup--h3-strong"">Cryptocurrency 101</strong>",4,4,Joseph Liebreich,2022-01-11
128,Omicron Arrival Reveals Leaders Unprepared for the Future of Work,7,580,Dr. Gleb Tsipursky,2022-01-11
130,To Buy or to Build?,4,48,Christina Stejskalova,2022-01-11
133,Learn Why Games Are Banned from using Web Scraping,4,14,Sarvesh Talele,2022-01-11
134,A Man Receives a Heart Transplant From a Pig for the First Time,2,6,slashdotted,2022-01-11
136,Insights from JP Morgan’s ,7,360,Thomas Herold,2022-01-12
138,Hunting Season! How to Get Free Crypto With Airdrops,7,41,Pavle Marinkovic,2022-01-12
139,"Tranquil Finance, An Interesting Lending Protocol on Harmony",7,66,Ann,2022-01-12
140,"<strong class=""markup--strong markup--h3-strong"">OpenSea Clone — Create NFT Marketplace like OpenSea</strong>",5,115,Lucas Andrew,2022-01-12
141,Crowd-Sourced Automatic Trading Strategies: Are They Any Good?,6,72,Thomas Dierckx,2022-01-12
142,P-DQN: An Unique Algorithm for Discrete-Continuous Hybrid Action Space,5,2,Kowshik chilamkurthy,2022-01-12
144,5 Telltale Signs You Are Dealing With a Toxic Person At Work,5,121,Mofrad Muntasir,2022-01-12
145,Should You Sell Growth Stocks in 2022?,3,109,Marc Guberti,2022-01-12
146,"What are the benefits of microservices, and will they pay for your business?",11,14,ITRex Group,2022-01-12
147,You Must Hedge Your Portfolio's Tail Risks,4,27,Carlos Pascual,2022-01-12
149,MetaWars: Metaverse Revolution For GameFI,6,22,Maximilian Perkmann,2022-01-12
150,Cypress Team Discovers Omicron-Delta Combined Variant While Some Believe It’s Just Contamination,4,25,"Natalie Frank, Ph.D.",2022-01-12
151,"<strong class=""markup--strong markup--h3-strong"">What are the top Metaverse and Gaming cryptos for 2022?</strong>",3,16,Smita Verma,2022-01-12
152,Is This the Greatest Economy ever?,3,20,Sanjeeb Basi,2022-01-12
153,4 Best Side Hustles You Can Do In 2022,5,100,Ravi Saroj,2022-01-12
154,"How Much I Made From Side Hustles in 2021 // UBER EATS, SKILLSHARE, PHOTO, MEDIUM & MORE..",4,2,Cole Connor,2022-01-12
155,Lessons From Uploading My First Skillshare Course,4,52,James Ssekamatte,2022-01-12
156,Ancient Knowledge Maybe the Key to Stress and Weight Reduction?,3,3,Dean Gee,2022-01-12
157,Remote Training and Virtual Mentoring for Hybrid and Remote Teams,8,601,Dr. Gleb Tsipursky,2022-01-12
158,Successful Networking Draws on Intense Power You Can Use Every Day,5,30,Jim Katzaman - Get Out of Debt,2022-01-12
159,Is Fantom (FTM) Worth The Hype?,7,100,Richmore Capital,2022-01-13
160,Are Luxury Watches An Asset Now?,3,116,Marx D.,2022-01-13
161,"How to Quickly Lose $10,000 in the Stock Market",3,10,Marc Guberti,2022-01-13
162,"Writing Hasn’t Been Part of the NFT Craze, But That’s About to Change",8,54,David J. Meyer,2022-01-13
163,Investing Vs. Trading — Time to Put an End to this Debate!,3,1,Sriram Balasubramanian,2022-01-13
164,Fauna’s Off-Chain Data Storage For DApps | Data Driven Investor,6,71,Vincent Tabora,2022-01-13
165,What's in a Name and the Why For of the Andersen Design Museum Of American Designer Craftsmen,17,1,Mackenzie Andersen,2022-01-13
166,How You Can Drive Better Innovation Into Your Business,5,61,Tavian Jean-Pierre,2022-01-13
167,Meaningful Data Will Lead to a Company’s Digital Success,6,47,Jim Katzaman - Get Out of Debt,2022-01-13
168,How to backtest Quantconnect’s (LEAN) strategies locally using Yahoo data and Python,7,52,Maurício Cordeiro,2022-01-14
169,I got scammed on crypto — again!,3,792,Jenn Leach,2022-01-14
170,My Experience Buying From Aliexpress,5,56,KD Writes,2022-01-14
171,Some Predictions for 2022 — Market Mad House,7,32,Daniel G. Jennings,2022-01-14
172,"<strong class=""markup--strong markup--h3-strong"">10 Things You Need To Ask Your Ethereum Staking Provider</strong>",8,31,Andrei Druta,2022-01-14
173,Why 90% of Hedge Funds Underperform the S&P 500,3,6,Krish Lulla,2022-01-14
174,The Buffett Indicator: Is the Market Cap to GDP Ratio in Your Investment Toolbox?,5,260,Ben the Trader,2022-01-14
175,"<strong class=""markup--strong markup--h3-strong"">OTC Crypto Exchange Development — A classic guide for startups</strong>",6,4,Emma Baker,2022-01-14
176,What You Can Expect From Architecture In The Next 10 Years?,8,114,Andrea Arias,2022-01-14
177,Ethereum vs. Cardano: How are they different from each other? Compare,4,9,Rashmeet Kaur,2022-01-14
179,"<strong class=""markup--strong markup--h3-strong"">15+ Reasons Why Business Should Prefer Using Chatbot</strong>",6,52,Emma Jhonson,2022-01-14
180,Decorators in Python for Beginners,4,104,Ayşe Kübra Kuyucu,2022-01-14
181,6 Ways Your PKM Can Drive You Towards a Better Life,2,19,Paco Cantero,2022-01-14
182,"Be Brave, Take a Tour of Your Ignorance.",9,8,Peter McClard,2022-01-14
183,"<strong class=""markup--strong markup--h3-strong"">2022 predictions: all in on blockchain, plus venture dollars to new places and new people.</strong>",4,101,Samantha Lewis,2022-01-14
184,How Real Estate Became My Side Hustle,5,177,Nate Meharg,2022-01-14
185,Imagine a world where human emotion is strictly forbidden,3,235,Rizwan Qaiser,2022-01-14
186,How Can I Carry This Millipede,6,2,Osundolire Oladapo Ifelanwa,2022-01-14
187,"<strong class=""markup--strong markup--h3-strong"">5 Ways to Turbocharge Your Finances in 2022</strong>",7,14,"Segun Ojediran, MSc",2022-01-14
188,Bitcoin as a fiscal policy tool,5,1,John V. Krompas,2022-01-14
189,Business Owners Try New Tactics to Reach Their Sales Targets,6,1,Jim Katzaman - Get Out of Debt,2022-01-14
190,Which NFT Staking Platforms are the best? Pros and Cons!,9,75,Henrique Centieiro,2022-01-15
191,What Is the Difference Between Fantom (FTM) & Polygon (MATIC),7,1100,Stephen Dalton,2022-01-15
192,What is A/B Testing? How to Perform an A/B Testing?,6,28,Rashida Nasrin Sucky,2022-01-15
193,The U.S. Federal Reserve Feeds Cryptocurrency Volatility,7,24,Patrick Tan,2022-01-15
194,The Metaverse: Hype vs Reality,7,34,Nitin Kumar,2022-01-15
195,CryptoThinks 2022 — Don’t Miss Yours,6,454,DigitalTime`s,2022-01-15
196,"Crafting clean, clear, compelling slides",6,11,"River D'Almeida, Ph.D",2022-01-15
197,Is the Life Science industry healthy?,5,12,Flavio Aliberti,2022-01-15
198,"Interview with Jill Kuhlman, Chief Administrative Officer at FST Logistics (Video & Podcast)",20,650,Dr. Gleb Tsipursky,2022-01-15
199,TEZOS: The Most Innovative Ethereum Competitor,10,129,Maximilian Perkmann,2022-01-16
200,One Strategy to Deal with The Currently Frustrating Crypto Market,5,274,Ann,2022-01-16
201,How Do Private Investors Evaluate an Early-Stage Company?,5,100,Christian Soschner,2022-01-16
202,Bitcoin A Visual History - Should you buy at the ‘top’?,10,38,Arslan Shahid,2022-01-16
204,The Best Financial Move I Ever Made Was to Start Tracking My Expenses,3,36,Marx D.,2022-01-16
205,"Drug Addiction Recovery and Blockchain Technology: Finally, hope for an epidemic that no lockdown or vaccine can...",4,239,Renato Zamagna,2022-01-16
206,When is the Best Time to Invest?,5,50,ARTInvest,2022-01-16
207,How to Get Your Message Across. Words Matter.,7,109,Joanne Reed,2022-01-16
208,Curious Case of Pandemic Orders and the One Treatment Rule,5,80,Opal A Roszell,2022-01-16
209,Good Multicultural Efforts Speak to Many People in Special Ways,3,6,Jim Katzaman - Get Out of Debt,2022-01-16
210,Why Do People Still Bullish on Bitcoin?,7,159,Ann,2022-01-17
211,"<strong class=""markup--strong markup--h3-strong"">Can NFTs Be Environmentally Friendly?</strong>",6,126,Sara Mohammed,2022-01-17
212,Top 10 Machine Learning Academic Research for Equity Portfolio Alpha,6,156,Futuris Perpetuum,2022-01-17
213,AI solutions for fraud detection,5,8,Mahbubul Alam,2022-01-17
214,Why is Cardano Rallying in 2022?,4,33,Mohamad Hakim,2022-01-17
215,"<strong class=""markup--strong markup--h3-strong"">How to Build Your Digital Horse Racing Game with a Zed Run Clone Platform?</strong>",5,2,Micheal King,2022-01-17
216,Digital Therapeutics (DTx) And Startups — Where We Are And Where We Are Going?,4,22,Amit Garg,2022-01-17
218,November 2021 Dividend Journey Update,4,2,Sivanand Birusumanti,2022-01-17
219,Being Human is a Welcome Difference That Attracts More Business,5,38,Jim Katzaman - Get Out of Debt,2022-01-17
220,How to Get Involved with Socially Responsible Investing,5,1,Aleksey (Aleks) Weyman,2022-01-17
221,The Obsidian’s Feature that Allows You to Build the PKM of Your Dreams,2,93,Paco Cantero,2022-01-18
222,Cardano launch first Decentralized Exchange,2,102,Alexandros Roumpos,2022-01-18
223,Don’t Believe These 5 Popular Lies About Data Science,5,401,Christopher Kokoski,2022-01-18
224,Deep Learning in Healthcare: Game-changing Technology,9,5,Quantum,2022-01-18
225,"<strong class=""markup--strong markup--h3-strong"">Why Choose a Dedicated Team Model for Outsourcing IT Projects?</strong>",7,1,Ajay Kapoor,2022-01-18
226,Are Great Leaders Born or Made?,5,35,Tavian Jean-Pierre,2022-01-18
227,People Need Your Solution — Why Aren’t They Buying?,2,45,Chris Gardener,2022-01-18
229,(Video & Podcast) Remote Training and Virtual Mentoring for Hybrid and Remote Teams,11,750,Dr. Gleb Tsipursky,2022-01-18
230,Is the Dotcom Bubble About to Repeat..?,6,189,Jamie Bullock,2022-01-19
231,Packaging and Optimizing Complex Python Application with cx_freeze (Installer and Executable file),5,106,Raoof Naushad,2022-01-19
232,7 Stages to Financial Freedom and How You Can Get There,3,49,Sanjeeb Basi,2022-01-19
233,Develop and Deploy Streamlit App which Predicts Mercedes Benz Car Prices on Heroku Platform,9,38,Sarvesh Talele,2022-01-19
234,"<strong class=""markup--strong markup--h3-strong"">Taking A Peek At Real Estate Tokenization</strong>",4,236,Adelina Vasile,2022-01-19
235,Auto — TS — Ensemble,3,61,Bob Rupak Roy - II,2022-01-19
237,3 Money Mistakes I Avoid Making in My Mid-Twenties.,9,524,Anirban Kar,2022-01-19
239,The 7% Conundrum: Why Today’s Inflation Numbers Are Not as Bad as You Might Have Been Led to,11,116,David Wyld,2022-01-19
240,Buffet’s Best Bet on Climate Change,3,141,Mike Hassaballa,2022-01-19
241,The Bulletproof Way To Get Rich Quick,5,85,Christian Soschner,2022-01-19
242,Omicron is an Existential Threat to Restaurants,8,258,Joshua Gane,2022-01-19
243,Virtual Assistants Help Fill a Small Business’ Most Urgent Needs,7,2,Jim Katzaman - Get Out of Debt,2022-01-19
244,"<strong class=""markup--strong markup--h3-strong"">Offshore vs. Nearshore Software Outsourcing: What’s Best for Your Business in 2022</strong>",7,6,Ajay Kapoor,2022-01-19
246,Make Money with Your Art,5,395,Brian Dickens Barrabee,2022-01-19
247,Bitcoin correction likely,2,70,Shefali O'Hara,2022-01-19
248,3 Smart Reasons to Try As Many Apps As You Can Without Seeing Them As Competitors,2,6,Paco Cantero,2022-01-19
249,There are four different stages in a company’s life cycle,3,4,Jan Mozer,2022-01-19
250,"Paying it Forward, and Years Later I Get Payback",5,90,Dean Gee,2022-01-19
251,Realistic Paychecks,3,142,Brian Dickens Barrabee,2022-01-19
252,"Oh, the Many Woes of Blockchain",5,3,Giles Crouch | Digital Anthropologist,2022-01-19
255,These 3 Indicators Could Predict the Next Crash: Some Are Flashing Red,5,67,Ardi Aaziznia,2022-01-20
256,Enter The Spirit Wars — Curve Wars All Over Again,7,35,Richmore Capital,2022-01-20
257,Connect To Database In Python Using Just 5 Lines Of Code,3,32,T.AI,2022-01-20
258,Celsius: Challenging Traditional Banking,8,3,Maximilian Perkmann,2022-01-20
259,We Need to Stop Calling “Meme Coins” Investments,5,60,Alvin T.,2022-01-20
260,What Does the New $600 IRS Tax Rule Mean for American Side Hustlers?,3,107,Marx D.,2022-01-20
261,How Docker Became the Only Saviour in Deploying API,5,15,T.AI,2022-01-20
262,What Our Near Future Looks Like,5,28,KD Writes,2022-01-20
263,4 Easy Ways to Make Your PKM Simpler and Be More Productive,2,49,Paco Cantero,2022-01-20
264,"<strong class=""markup--strong markup--h3-strong"">Invest In The Picks And Shovels, Not The Gold</strong>",5,235,Dessy John,2022-01-20
265,"<strong class=""markup--strong markup--h3-strong"">7 Fun Networking Ideas If You Actually Hate Networking</strong>",4,12,Cal Axe,2022-01-20
266,How the Rise of Individualism Affects Our Companies,5,8,Tavian Jean-Pierre,2022-01-20
267,Six Lessons From My First Year of Investing,5,7,Rob Dods,2022-01-20
268,The Fed’s Inflation Trolley Problem,3,17,Andrew Busch,2022-01-20
269,"<strong class=""markup--strong markup--h3-strong"">The Most Important Financial Indicator Is Not Necessarily Your Net Worth — Here’s Why</strong>",4,11,Paulo A. José,2022-01-20
270,An overview of,4,60,Albert Christopher,2022-01-20
271,At Issue: Where Are the Issues?,3,11,Jaci Clement,2022-01-20
272,"<strong class=""markup--strong markup--h3-strong"">How can blockchain technology uncover the real Power of IoT?</strong>",4,21,Rashmeet Kaur,2022-01-20
273,Hearing From Customers is the Best Way to Improve Service,4,1,Jim Katzaman - Get Out of Debt,2022-01-20
274,Does Cardano have a future? Should you consider it?,3,55,Smita Verma,2022-01-21
275,Stop Dollar-Cost Averaging Into Bitcoin,4,452,Mark Helfman,2022-01-21
276,Which Is the Best “Cold” Wallet for Your Crypto,7,483,Stephen Dalton,2022-01-21
277,Why is Microsoft Paying $68.7bn for Activision Blizzard?,12,3,Clark Boyd,2022-01-21
279,A Story Generator Using LSTM inside Recurrent Neural Network (RNN),8,3,Ruslan Brilenkov,2022-01-21
281,Understanding the framework for cheque processing using Blockchain Technology,4,22,Rashmeet Kaur,2022-01-21
282,“The Only 2 Concepts Knowledge Workers Need to Know to Start Setting Up Their PKM”,2,28,Paco Cantero,2022-01-21
284,"<strong class=""markup--strong markup--h3-strong"">Seven Financial Goals to Achieve Before Age 30 to Retire Well</strong>",5,12,Paulo A. José,2022-01-21
285,A Must Read Article for every ML Engineer/ Data Scientist if you want to deploy ML App on cloud in few steps,5,4,Sanket Maheshwari,2022-01-21
286,Stock Chart Generator Wave App,3,22,Thomas Ott,2022-01-21
287,"If You Plan To Retire Someday, Consider Monetizing Your Passion",5,3,Paulo A. José,2022-01-21
288,"If You Don’t do it, You Can’t Teach It",5,21,"Jessica Lyon & Joshua J. Lyon, BSQP, CNP (J & J)",2022-01-21
289,Is Alibaba (BABA) the best Value Stock in Ecommerce? — Market Mad House,4,7,Daniel G. Jennings,2022-01-21
290,An alternative use of Data: How I used principles of financial management to better manage my weight,5,12,John V. Krompas,2022-01-21
293,Not Angry About Housing Prices? You Should Be.,8,1200,Joe Duncan,2022-01-22
294,Download list of ALL stock symbols using this Python package,4,268,Yong Hong Tan,2022-01-22
295,Using YNAB for 1 Year Now,7,223,Nate Meharg,2022-01-22
296,Translation of French articles followed by Summarization,6,9,Priya Dwivedi,2022-01-22
297,New Wearable COVID Trackers May Become Available Soon,3,52,"Natalie Frank, Ph.D.",2022-01-22
298,Microsoft to acquire Activision Blizzard for $68.7 billion,3,5,Hekuran Gashi,2022-01-22
299,TikTok Collects a Huge Audience That Any Business Would Want,4,1,Jim Katzaman - Get Out of Debt,2022-01-22
300,The Insane Future of Web 3.0 and the Metaverse,8,354,Henrique Centieiro,2022-01-23
301,A Simple Guide to Real-Time Speech Recognition in Python,4,176,The PyCoach,2022-01-23
302,Stocks Alone Won’t Make You Rich,6,162,B. Wright,2022-01-23
303,"<strong class=""markup--strong markup--h3-strong"">How Can I Earn a Passive Income from the Metaverse?</strong>",5,53,Sara Mohammed,2022-01-23
304,Why did the crypto market crashed at 21/01/2022,4,21,Alexandros Roumpos,2022-01-23
305,How to Trade Using Support and Resistance Levels,5,57,Jason Milton,2022-01-23
306,How To Find Good Dividend Stocks,10,118,Building Arks with Jason Clendenen,2022-01-23
307,"Dispelling the Fear, Uncertainty & Doubt (FUD) Around Bitcoin",7,78,Geeta Anjali,2022-01-23
308,How To Get From Zero To 400k+ Website Visitors In 12 Months,3,546,Mofrad Muntasir,2022-01-23
309,Use Tor For Everything: Privacy Misconception,4,31,Sam Writes Security,2022-01-23
310,5 Ways a PKM Can Help Overwhelmed Entrepreneurs to Take Control Back to Their Lives,2,7,Paco Cantero,2022-01-23
