,title,reading_time,like,writers,date
1593,How to Switch from Living Paycheck to Paycheck to Investor in 30 Minutes or Less,4,207,Desiree Peralta,2022-04-08
1594,Lessons (Not) Learned from Past Financial Bubbles,7,208,Thomas Herold,2022-04-08
1595,💥 Ethereum $10k in 2022​,4,105,Carlos Pascual,2022-04-08
1596,What To do Instead of Just Working Hard if You Want To Get Rich?,6,71,Marcus Tan,2022-04-08
1597,Getting Started with the Python Pandas Library,5,10,"Sadrach Pierre, Ph.D.",2022-04-08
1598,All HCOL Areas Are Not the Same,6,2,B. Wright,2022-04-08
1599,"Before You Pick Your Dream Side Hustle, Ask Yourself This One Easy Question",4,150,Cal Axe,2022-04-08
1600,Shark Tank India Analysis — Salesforce — Tableau Integration from scratch,4,57,Durvesh Shah,2022-04-08
1601,"<strong class=""markup--strong markup--h3-strong"">A Cybersecurity ETF Worth Keeping an Eye on</strong>",2,1,Tunji Onigbanjo,2022-04-08
1602,Trading Plan: 8 April 2022,3,9,Laurentiu Chisca,2022-04-08
1604,Forcing Diversity Sustains Racist & Discrimination Stigmas,6,7,"Jessica Lyon & Joshua J. Lyon, BSQP, CNP (J & J)",2022-04-08
1606,Can Elon Musk Make Money from Twitter (TWR)? — Market Mad House,6,58,Daniel G. Jennings,2022-04-08
1607,Client Sit-Down: Entertainment Industry,6,50,"Jessica Lyon & Joshua J. Lyon, BSQP, CNP (J & J)",2022-04-08
1608,Constellation Brands stock rallies after beating Q4 expectations,3,9,ARTInvest,2022-04-08
1609,SpaceX Launches First All-commercial Crew to Space Station,3,7,slashdotted,2022-04-08
1610,"News, Politics & The Art of Credibility",4,8,Jaci Clement,2022-04-08
1611,Why Duplicating Data in 2 Apps of Your PKM Is Not a Drama If Your Workflow Is Well-Defined,2,19,Paco Cantero,2022-04-09
1612,A Decentralizing World Needs Decentralized Currency,7,81,Patrick Tan,2022-04-09
1613,Physical NFT | Jacob & Co Launches Digital And Physical NFT Watches,7,12,Jessica Wilson,2022-04-09
1614,Using Data Science to Crack The Personalized Marketing Code,6,8,Rijul Singh Malik,2022-04-09
1615,"Why Ethereum Will Hit $10,000",3,6,Rabinder Kumar,2022-04-09
1617,Big News About Avalanche Cryptocurrency You Should Consider,4,535,Stephen Dalton,2022-04-09
1618,China and US' Short-Lived Relationship,5,6,Mohamad Hakim,2022-04-09
1619,Preventing cloud migration failures with QA: 6 steps to make,5,11,Mike Urbanovich,2022-04-09
1620,China’s Yuan is getting Attraction because of Russia-Ukraine War,5,10,Vishnuaravi,2022-04-09
1621,Do schools kill creative geniuses?,6,221,William Barter,2022-04-09
1622,How to Go Paperless,5,62,Toby Kiernan,2022-04-09
1623,Workplace Wellness in the Modern Economy,4,59,Alex Lago,2022-04-09
1624,How To Run a Successful Corporate Blog,8,17,Gil Mahesh,2022-04-09
1625,The Great Easter Bunny Hack!,7,11,Matt | Financial Imagineer,2022-04-09
1626,Serendipitous Innovation Advantage for Hybrid and Remote Teams (Video & Podcast),11,407,Dr. Gleb Tsipursky,2022-04-09
1627,What Are the Smartest Guys Saying About the Future Of Crypto?,5,319,Pavle Marinkovic,2022-04-10
1628,Why Metaverse Will Erase Bitcoin,9,103,Ilona D.,2022-04-10
1629,Top 13 Cloud Compliance Terms You Absolutely Need To Know,4,259,Satyen Kumar,2022-04-10
1630,"Lucid Motors, claims topping Tesla’s range?!",4,27,ARTInvest,2022-04-10
1631,The Best Savings Tool for You in 2022 is Not What You Would Expect,4,1500,Tom Handy,2022-04-10
1632,"<strong class=""markup--strong markup--h3-strong"">Thinking About Making a Large Purchase?</strong>",3,6,Joseph Liebreich,2022-04-10
1633,Investing your cups of coffee.,3,9,Piotr Szymanski,2022-04-10
1634,There is No Such Thing as a Bad Job,5,77,Cinto,2022-04-10
1635,"Revenge Bedtime Procrastination shortens lifespan, and you are clueless how it is affecting you.",8,2,Bryce Barrows,2022-04-10
1636,"<strong class=""markup--strong markup--h3-strong"">The most advanced metaverse P2E gaming awaits its first-ever cricket game with exclusive NFTs !!!</strong>",4,1,Kevingeller,2022-04-10
1637,Make Your Pain Pay to Grow Your Business with Storytelling,4,1,Jim Katzaman - Get Out of Debt,2022-04-10
1638,"<strong class=""markup--strong markup--h3-strong"">Incentives and User Experience</strong>",4,50,Ed Newman,2022-04-10
1639,"<strong class=""markup--strong markup--h3-strong"">Does the Mainstream Adoption of Cryptocurrencies Rely On . . . Web 3.0?</strong>",4,15,Sara Mohammed,2022-04-10
1641,"The Week Ahead. What you need to know — 11th April, 2022",3,62,ARTInvest,2022-04-10
1643,How They Die,3,100,Øivind H. Solheim,2022-04-10
1644,A Powerful No Code Data Science Tool That Will Change Your Life,13,303,Sagarnil Das,2022-04-11
1645,5 of the Biggest NFT Drops in April 2022,10,104,Christian Jensen,2022-04-11
1646,"Polestar, a Tesla Competitor, Could Spike When It Goes Public",3,54,Mark Hake,2022-04-11
1647,Uranium Energy Corp is a Must Have Stock,4,4,Armchair Banker,2022-04-11
1648,The Easy Guide to +1000% return,4,151,Giu Ettorre,2022-04-11
1649,You’ve Got To Be An Attention Whore,8,14,Kurtis Pykes,2022-04-11
1650,What To Do If You Are Mentally Tired Of Everything,4,23,Gil Mahesh,2022-04-11
1651,Brian Feroldi Explains Why You Should Compound Like Sally,6,6,Christian Soschner,2022-04-11
1652,The President of Russia,6,50,Øivind H. Solheim,2022-04-11
1653,"A $300,000 Crown You Can Only Wear In Metaverse",3,25,Rabinder Kumar,2022-04-11
1655,Can Robinhood (HOOD) grow with the Lightning Network? — Market Mad House,4,24,Daniel G. Jennings,2022-04-11
1656,Momentum Trade — Cholamandalam — 11 April 2022,3,10,Sriram Balasubramanian,2022-04-11
1658,Trading Plan: 11 April 2022,3,9,Laurentiu Chisca,2022-04-11
1661,The Coming Divorce of Chimerica,9,273,Meziechi Nwogu,2022-04-12
1662,How to Create Wealth with Only $500 a Month,4,460,Desiree Peralta,2022-04-12
1663,"Recommendation System with Graphs at eCommerce and Foodtech: Flipkart, UberEats, Swiggy, Instacart, Delivery Hero...",6,34,Shaurya Uppal,2022-04-12
1664,How to Stay Calm When Triggered,6,575,Nita Jain,2022-04-12
1665,Everything You Wanted to Know About GraphQL (But Were Afraid to Ask),7,349,Satyen Kumar,2022-04-12
1666,Data-Driven Culture Starts with Data Engineers,8,86,Sarah Floris,2022-04-12
1667,NFT Art | NFT artist sold $20 million of his digital work in 24 hours,3,14,Stanley Thomas,2022-04-12
1668,What is the Perfect Bet Size?,5,12,Carl Westerby,2022-04-12
1669,Riding The Sandbox Rollercoaster,6,42,Jeran Miller,2022-04-12
1670,What IGN’s Controversy Can Teach Us About Medium’s Payments,7,11,James Ssekamatte,2022-04-12
1671,How to Become a Better Investor — 20 Ways to Improve,13,60,Matt | Financial Imagineer,2022-04-12
1672,Apple May Have Unintentionally Revealed a New Mac Mini,5,9,slashdotted,2022-04-12
1673,Why Do People pay Thousand of Dollars for NFTs?,3,80,Abimbola Abe,2022-04-12
1675,Creative Kung Fu,6,96,William Barter,2022-04-12
1676,Investing in Clorox(CLX) — Rise and Shine ✨,5,11,ARTInvest,2022-04-12
1677,Trading Plan: 12 April 2022,3,16,Laurentiu Chisca,2022-04-12
1678,Honda Plans to Release 30 EV Vehicles by 2030,4,15,slashdotted,2022-04-12
1679,How To Quickly Calculate The Value Of A Stock (with Template),7,185,Thomas Herold,2022-04-13
1680,What Is Web3.0? A Beginner’s Guide.,3,130,Abimbola Abe,2022-04-13
1681,Technology Continues to Outpace Wisdom,8,1,Peter McClard,2022-04-13
1682,The Correction in Startup Valuations,3,6,Krish Lulla,2022-04-13
1683,Top 5 Electric Vehicle (EV) Stocks to Invest In,5,19,Mike Toney-Hoffman,2022-04-13
1684,How Remote Working Might Change the World,5,60,Tavian Jean-Pierre,2022-04-13
1685,Real yields hit 0% — Bear market coming?,3,15,Sagar Singh Setia,2022-04-13
1686,Hair Stylist Makes a Guaranteed $6000 Per Month,4,10,Annie Wegner,2022-04-13
1687,How I Plan to Be Rich,4,12,Mohamad Hakim,2022-04-13
1688,"<strong class=""markup--strong markup--h3-strong"">Partake in the World’s First Cricket NFT Game | Coming Soon</strong>",4,17,Namrata Gouda,2022-04-13
1689,How To Invest $1.000 In 2022,5,7,Cedric Boogaerts,2022-04-13
1691,7 Types Of Content To Help Grow Your Audience,3,62,Gil Mahesh,2022-04-13
1693,How to succeed in ANY economy,3,50,Chris Gardener,2022-04-13
1695,The Truth Behind Google’s Machine Learning Research,8,273,Devansh- Machine Learning Made Simple,2022-04-14
1696,How Much Cash Do the Rich Keep in Their Bank Accounts?,5,542,Lauren Como,2022-04-14
1697,The East Defeats the West in IQ by Country,4,24,Dean Gee,2022-04-14
1698,"<strong class=""markup--strong markup--h3-strong"">Black Swan Events and the Economy.</strong>",4,3,Joseph Liebreich,2022-04-14
1699,Estimate Strength of the Stock Market Recovery.,4,159,Paul Blazejewski,2022-04-14
1700,How to Invest in Crypto Without Buying Crypto,8,139,Ilona D.,2022-04-14
1701,"Stacks: Enabling Staking, NFTs, and DeFi for Bitcoin",6,94,Maximilian Perkmann,2022-04-14
1702,The Biggest Issue I See With Technical Slides — With Examples,7,190,"Sam Westreich, PhD",2022-04-14
1703,"<strong class=""markup--strong markup--h3-strong"">How to Design Your Environment and Habits for 10x Success</strong>",7,2,Fahri Karakas,2022-04-14
1704,Product Review: Webull Announces Three New Crypto Listings,7,451,Stephen Dalton,2022-04-14
1705,6 Years Of Work Experience Taught Me How to Fail Forward. Here’s 5 Things I’ve Learnt.,6,53,Jason Huynh,2022-04-14
1706,Why Your Titles At Work mean Nothing,5,151,Afroz Chakure,2022-04-14
1707,"<strong class=""markup--strong markup--h3-strong"">DeFi for Banking The Unbanked</strong>",4,116,Vishal Muktewar,2022-04-14
1708,The Must-Know Secrets to What Makes a Person Confident,2,42,Lukas Schwekendiek,2022-04-14
1709,Is drilling for money is better than drilling for heat?,4,201,Mike Hassaballa,2022-04-14
1710,Growth-Stage Companies Increasingly Must Embrace the ‘Micro Fund’ Ecosystem,6,3,Marc Patterson,2022-04-14
1712,Top 6 Cryptocurrency Stocks You Should Invest In,4,1,Mike Toney-Hoffman,2022-04-14
1714,Predicting the S&P500 with the FED Balance Sheet,9,68,Antoine Dedave,2022-04-15
1715,Train and Deploy an NLP News Classifier Web App to the Cloud for Free,21,5,Damian Boh,2022-04-15
1716,4 Ways To Invest During a Recession,4,755,Alexandre Lores,2022-04-15
1717,One of the Safest & Securest Investments Right Now,3,36,Marx D.,2022-04-15
1718,5 Ways to Invest Better During Rising Interest Rates,3,451,Alexandre Lores,2022-04-15
1719,Politics Causes America’s Housing Bubble — Market Mad House,7,66,Daniel G. Jennings,2022-04-15
1720,Databricks: Name your queries,2,4,Ganesh Chandrasekaran,2022-04-15
1721,10 Unrevealed NFT Trends: How Crypto Millionaires Are Driving a Boom in the Digital Art Market,6,1,Amit Biwaal,2022-04-15
1722,How Good Leaders Win Others Trust,5,103,Tavian Jean-Pierre,2022-04-15
1723,Why I’m Avoiding NFTs (at all costs),3,10,Mohamad Hakim,2022-04-15
1725,"<strong class=""markup--strong markup--h3-strong"">4 Costly Mistakes Investors Still Make in the Stock Market</strong>",4,5,"Segun Ojediran, MSc",2022-04-15
1726,The creativity scale: effort makes all the difference,4,70,William Barter,2022-04-15
1727,Revising Performance Evaluations for Hybrid and Remote Teams (Video & Podcast),11,500,Dr. Gleb Tsipursky,2022-04-15
1728,Everyone Needs Support to Overcome the Sting of Harassment,8,1,Jim Katzaman - Get Out of Debt,2022-04-15
1729,Databricks: How to identify skew in your data?,2,20,Ganesh Chandrasekaran,2022-04-16
1732,The Biggest Boon to the Dollar is Decentralized Currencies,7,59,Patrick Tan,2022-04-16
1733,"NFT Avatars 101: The What, How, and Why",11,22,Christian Jensen,2022-04-16
1734,The one thing you should look for in a co-founder,4,78,Younes Khadraoui,2022-04-16
1735,These are 10 things That Set The Tone of The Cloud Strategy,2,334,Satyen Kumar,2022-04-16
1736,3 Mistakes Data Analysts Should Avoid With Stakeholders,3,74,Vicky Yu,2022-04-16
1737,Why These 5 Reasons Will Convince You That Machine Learning Predictions Are Screwed Up,7,123,Jason Huynh,2022-04-16
1738,"Elon Musk Wanted To Buy Twitter, but the Board Didn’t Like It. And then this happened",7,55,Christian Soschner,2022-04-16
1740,Blockchain Bridges in 3 minutes,4,14,Ash Perera,2022-04-16
1741,Aggressive Investors: Here Are 7 Bank Account Boosters That Flew Under Your Radar,5,7,Joseph Seifert,2022-04-16
1742,I Did This To Make Money,3,102,Mohamad Hakim,2022-04-16
1744,Best Investment Strategies For Investors to Profit From Skyrocketing Energy Prices,9,154,Ilona D.,2022-04-17
1745,"<strong class=""markup--strong markup--h3-strong"">Inflation Has Nothing To Do With High Prices, It Means You Earn Less Than You Think</strong>",4,22,Paulo A. José,2022-04-17
1746,What is Inflation?,10,14,Matt | Financial Imagineer,2022-04-17
1747,Personal Finance 101,3,286,ARTInvest,2022-04-17
1748,"Investing next week. What you need to know —18 April, 2022",3,11,ARTInvest,2022-04-17
1749,6 Things To Consider Before Investing.,4,10,Mustafa Seye Dieng,2022-04-17
1750,Take Advantage of Audio to Make Your Voice Stand Out,3,10,Jim Katzaman - Get Out of Debt,2022-04-17
1751,Top 5 Latest Biotechnological Discoveries in 2022,3,52,ARTInvest,2022-04-18
1752,Don’t let Spark Optimizer decide everything,4,6,Ganesh Chandrasekaran,2022-04-18
1753,Data Science Activity in a Corporate Company,5,27,Cornellius Yudha Wijaya,2022-04-18
1754,Can We Talk About a Bear Market in Crypto Right Now?,5,116,Alexandros Roumpos,2022-04-18
1755,"Tesla Stock — ARK’s $4,600 Price Target for 2026",4,31,Willi Wiedergold,2022-04-18
1756,Here’s How You Can Hit 10k+ in Just 10 Days As New Coach,6,103,Ozzin Jun,2022-04-18
1757,4 Ways You May Be Using Data Analytics Poorly,6,15,Rijul Singh Malik,2022-04-18
1758,Gitcoin,4,124,Olympus Zephyr,2022-04-18
1759,"The Easiest, Cheapest, and Most Cost-Effective Way to Buy NFTs",4,1,Carlos Pascual,2022-04-18
1760,The Hardest and Most Useful Skill to Master: Persistence,4,39,Lukas Schwekendiek,2022-04-18
1761,What is Money? It’s a Representation of Future Productivity.,4,114,Single Founder,2022-04-18
1762,The Top 5 Healthcare Stocks That You Should Invest In,5,13,Mike Toney-Hoffman,2022-04-18
1763,Digital Voting Will Save Democracy,11,50,Peter McClard,2022-04-18
1764,Trading Plan: 18 April 2022,3,10,Laurentiu Chisca,2022-04-18
1765,"Turmoil everywhere, time to be cautious?",4,1,Sagar Singh Setia,2022-04-18
1766,Reaching Out to People Gives You Valuable Customers for Life,5,9,Jim Katzaman - Get Out of Debt,2022-04-18
1767,A Freakish Genius at Something,4,26,William Barter,2022-04-18
1768,Build a Stock Sentiment Web App with Flask and Deploy it Online,10,45,Damian Boh,2022-04-19
1769,Play Games and Earn Money,5,13,Geoffrey Gardiner,2022-04-19
1770,The Average 401k Balance By Age,5,91,Lauren Como,2022-04-19
1771,The Flaws in How We Compare Education Systems,16,1,Jerry Gao,2022-04-19
1772,JP Morgan’s 2022 Stock Market Guide (Part 2),7,30,Thomas Herold,2022-04-19
1773,"<strong class=""markup--strong markup--h3-strong"">Details You Have To Know About NFT Development — An Outline</strong>",6,99,Christian Edward,2022-04-19
1774,What Is the Bitcoin (BTC) Lightning Network & Why Is It Important,6,310,Stephen Dalton,2022-04-19
1776,5 Ways That Investment Diversification Can Be a Timeless Winning Strategy,7,13,"Spyros Ierides, CFA",2022-04-19
1777,"<strong class=""markup--strong markup--h3-strong"">The IRS and Cryptocurrencies</strong>",3,101,Joseph Liebreich,2022-04-19
1778,Mistakes you can make during a dividend stock research ☝️,4,2,ARTInvest,2022-04-19
1780,4 Things You Shouldn’t Do When Raising Capital from VCs,6,7,Christian Soschner,2022-04-19
1781,"True Meaning Of DAOs — Understanding A New, Emerging Phenomenon",5,9,TobiasMJ,2022-04-19
1783,Firing People? 4 Practical Guidelines (And The 3 Questions) For Startups,4,3,Amit Garg,2022-04-19
1785,Fear and imagination: the most powerful combination in the universe,5,137,William Barter,2022-04-19
1787,The pursuit of happiness: the unimaginable challenges deeply desired by our souls,3,60,William Barter,2022-04-19
1788,Investing in Dividend ETFs: What You Need to Know,7,111,Ilona D.,2022-04-20
1789,DASH: 90% Below the All-Time High. Buying Opportunity?,8,63,Maximilian Perkmann,2022-04-20
1790,Could NEAR Be the “Ethereum Killer” Many Are Looking for in Cryptocurrency,6,464,Stephen Dalton,2022-04-20
1791,"<strong class=""markup--strong markup--h3-strong"">Money Management 101: Money Lessons from Game of Thrones</strong>",10,6,Julius Masaba,2022-04-20
1793,The Study That Links Bitcoin Fans To Psychopaths Debunked,5,3,Ras Vasilisin,2022-04-20
1794,"<strong class=""markup--strong markup--h3-strong"">Elon Musk vs Twitter vs Free Speech</strong>",11,377,Dan Clinciu,2022-04-20
1795,The US Economy Following the Path of Rome,4,61,Meziechi Nwogu,2022-04-20
1797,Can Snowflake (SNOW) make money from the Data Cloud? — Market Mad House,7,4,Daniel G. Jennings,2022-04-20
1798,Data-centric Transformation in the Construction Industry,4,20,Aydın Fevzi Özçekiç,2022-04-20
1799,Inflation Is Not Peaking,2,2,Jonathan Garner,2022-04-20
1800,5 Metaverse/NFT Myths You Must Debunk!,2,72,Abimbola Abe,2022-04-20
1801,What happened to Netflix,2,100,ARTInvest,2022-04-20
1802,Histographics 2.0. Why Sleep Is So Important For Fat Loss,7,50,Joanne Reed,2022-04-20
1804,How Finance May Be Changing for the Better,6,161,Tavian Jean-Pierre,2022-04-20
1806,"<strong class=""markup--strong markup--h3-strong"">This Behavioural Impulse Can Help You Beat Procrastination</strong>",4,15,"Segun Ojediran, MSc",2022-04-20
1807,"<strong class=""markup--strong markup--h3-strong"">Is Social Media Useful for Buying and/or Trading Stock?</strong>",3,4,Joseph Liebreich,2022-04-20
1808,No Country for Old Men: let’s do a revolution for a really new education,5,97,William Barter,2022-04-20
1809,"If You Live in 1 of These 9 Cities, it Might be Time to Leave",4,1500,Dean Gee,2022-04-21
1810,Easily Optimize a Stock Portfolio using PyPortfolioOpt in Python,10,156,Damian Boh,2022-04-21
1811,Do you want to become a Data Architect?,3,210,Gaurav Thalpati,2022-04-21
1813,Spark: How to parse a text file containing Array data,4,1,Ganesh Chandrasekaran,2022-04-21
1814,Is Now The Best Time To Invest in China?,9,68,Ilona D.,2022-04-21
1815,In Just Under 1 Minute Convert Medium Posts to Markdown for Your Blog,4,64,Mala Deep,2022-04-21
1816,Why This MTHFR May Save Half the US Population.,3,16,Dean Gee,2022-04-21
1817,5 Practical Ways to Protect Yourself Against Inflation,5,32,Jason Huynh,2022-04-21
1818,7 Ways To Invest in the Metaverse,10,12,Christian Jensen,2022-04-21
1819,Microsoft will use the Data Centres to heat Finnish Homes Emission-free,6,5,Vishnuaravi,2022-04-21
1820,Six Unique Ways Your Teens Can Earn Extra Cash,4,26,Dr. Deborah M. Vereen,2022-04-21
1821,Pinpoint Your True Influencers with Product-Market Fit,4,26,Ashley Ashbee,2022-04-21
1822,Brutal Game of Musical Chairs Has Begun in Sri Lanka,3,150,Ras Vasilisin,2022-04-21
1823,GitOps vs DevOps — What’s the difference?,6,2,ELEKS,2022-04-21
1824,Elon Musk Buys Twitter For $44 Billion,6,22,Mofrad Muntasir,2022-04-21
1825,15 Lessons Learned for R&D Projects,2,20,Aydın Fevzi Özçekiç,2022-04-21
1828,Has Weather Modification Taken Over the Sky?,4,100,Opal A Roszell,2022-04-21
1829,"<strong class=""markup--strong markup--h3-strong"">A Quick Overview of 5 Categories to Assist You in Establishing a Monthly Budget</strong>",2,13,Tunji Onigbanjo,2022-04-21
1831,What is the price you must pay for your time on Earth?,2,14,Bryce Barrows,2022-04-21
1832,What the News Is Missing,3,10,Jaci Clement,2022-04-21
1833,Marketing Data Science — Lead Prediction,11,25,Andreas Stöckl,2022-04-22
1834,"<strong class=""markup--strong markup--h3-strong"">Learn in 5 Minutes How I’ve Improved My PKM and Life In 5 Years Moving from App to App</strong>",5,64,Paco Cantero,2022-04-22
1835,Beat the Market with Spin Offs,6,25,Carl Westerby,2022-04-22
1836,How Discrete Event Simulation is used in Health Care (and during COVID-19),14,12,Kartikeya Rana,2022-04-22
1837,"I did NLP on 10 Years Worth of Berkshire Shareholders Letters, Here’s What I...",4,54,Jason Huynh,2022-04-22
1838,Top 5 Renewable Energy Stocks You Should Invest In,6,27,Mike Toney-Hoffman,2022-04-22
1839,Best renewable energy to watch out for in 2022,4,155,ARTInvest,2022-04-22
1840,The two ways to earn money,4,175,ARTInvest,2022-04-22
1841,Diversity in the Workplace Goes Passed Skin Colour,5,11,Tavian Jean-Pierre,2022-04-22
1842,DeFi Marketing Services Puts You In The Financial Forefront,5,12,Ryanhelen,2022-04-22
1843,How to be Rich and Successful (Start Here),3,10,Mohamad Hakim,2022-04-22
1844,Trading Plan: 22 April 2022,4,10,Laurentiu Chisca,2022-04-22
1845,Cryptocurrency and Blockchain: What You Need to Know,5,180,Mike Toney-Hoffman,2022-04-22
1846,Is Avis Budget (CAR) worth $298.07? — Market Mad House,5,36,Daniel G. Jennings,2022-04-22
1847,How One Idea Can Multiply Your Income And Happiness,3,146,Daniel R Silva,2022-04-22
1848,How Growth Hacking Makes Businesses Take Off,4,13,Gil Mahesh,2022-04-22
1849,Tesla Generates a Record Profit In Q1 2022,2,118,Ghani Mengal,2022-04-22
1850,"<strong class=""markup--strong markup--h3-strong"">Calm down, the robots won’t take your video editing job. You’ll just get a little helper</strong>",6,62,Pavel Saskovec,2022-04-22
1851,Help! I’ve Fallen and I Can’t Get Up!,3,469,Stony Brooks,2022-04-22
1852,"<strong class=""markup--strong markup--h3-strong"">A Complete Step-by-Step Guide for Pricing American Option</strong>",8,7,Peyman Kor,2022-04-23
1853,What’s Happening With Netflix,4,12,slashdotted,2022-04-23
1854,5 Best NFT Drops in Late April 2022,10,73,Christian Jensen,2022-04-23
1855,"<strong class=""markup--strong markup--h3-strong"">Is a Recession Coming Soon?</strong>",3,53,Joseph Liebreich,2022-04-23
1856,Leveraged ETF vs Market Volatility,12,29,Felipe Sanchez Garzón,2022-04-23
1857,Do These 8 Things Immediately If You Want to Increase Your Quality of Life by 10x,12,69,Fahri Karakas,2022-04-23
1858,Traditional Advertising May Just Die,12,1,Peter McClard,2022-04-23
1859,Why the News about Netflix should not Surprise Anyone,5,4,Armchair Banker,2022-04-23
1860,Warner Bros Discovery Has Attractive Out-of-The-Money Covered Calls,4,1,Mark Hake,2022-04-23
1861,Can You Make Passive Income Without Any Investment?,3,54,Mohamad Hakim,2022-04-23
1862,A good stock to buy in the US Industrial sector,5,85,Laurent Risser,2022-04-23
1864,"So, You Think Your Job Application is Good?",4,51,"Jessica Lyon & Joshua J. Lyon, BSQP, CNP (J & J)",2022-04-23
1866,Say Hello to the CHO,5,151,Dr. Gleb Tsipursky,2022-04-23
1867,New to Crypto? Here’s What You Need to Know — 2022 Guide,22,252,Col Jung,2022-04-24
1868,Exploring HuggingFace Transformers For Beginners,5,170,Cornellius Yudha Wijaya,2022-04-24
1869,Copying Warren Buffett’s Stock Picks Will Not Fetch a Fortune.,5,28,Sriram Balasubramanian,2022-04-24
1870,Get Used to Shortages of Food and Other Goods — It’s Going to Get Worse,5,58,Pavle Marinkovic,2022-04-24
1871,Top 5 Opensea NFTs,5,17,Stanley Thomas,2022-04-24
1872,Could Crypto be the Unexpected Beneficiary of Present Challenges?,9,104,Patrick Tan,2022-04-24
1873,4 Tips to Help You Engage in More Productive Disagreements,7,183,Nita Jain,2022-04-24
1874,5 More Ways for Regular People to Invest in Virtual Real Estate,8,20,Jeran Miller,2022-04-24
1875,Product Review: The hi Mobile Banking App & Crypto Buying Source,7,355,Stephen Dalton,2022-04-24
1877,Making Money on Medium,2,322,Brian Dickens Barrabee,2022-04-24
1878,First impressions in the digital era are more volatile,5,9,Swaroop Bhagavatula,2022-04-24
1879,How to Make Money on Robinhood,3,92,Mike Toney-Hoffman,2022-04-24
1880,Investing next week. What you need to know — 25 April 2022,3,10,ARTInvest,2022-04-24
1881,Money Talks!,4,59,Daniella Cressman,2022-04-24
1882,Know your spending and set your financial goals,4,13,ARTInvest,2022-04-24
1883,Evergreen Video Gives Your Best Ideas a New Lease on Life,4,59,Jim Katzaman - Get Out of Debt,2022-04-24
1884,Build your Own Stock Portfolio Optimizer Web App with Streamlit,8,118,Damian Boh,2022-04-25
1885,Sell When The Yield Curve Inverts? Here Is My Data-Driven Answer,7,58,David L.,2022-04-25
1886,Optimize Python code for Speed and Performance — Tips and Tricks,3,8,Raoof Naushad,2022-04-25
1887,6 Things I Wished I Knew Before I Started Investing,8,107,David L.,2022-04-25
1888,Don’t Wait for the “FED Put” Because this Time it’s Different!,6,21,Sagar Singh Setia,2022-04-25
1889,Brian Armstrong Explains Why Coinbase is a Mission-Focused Company,4,9,Christian Soschner,2022-04-25
1891,What Is Monero (XMR) Cryptocurrency & Why Is It Surging,6,425,Stephen Dalton,2022-04-25
1892,Making Sense of the Gender Pay Gap,6,94,Joe Duncan,2022-04-25
1893,Everything You Must Know About Investing in Ethereum,6,54,Ilona D.,2022-04-25
1895,An Analysis of Netflix Subscriber Numbers: Why the Exodus May Not Be So Rational.,3,17,Jason Huynh,2022-04-25
1896,Why Germany Is Best for Crypto Investments,3,58,Rabinder Kumar,2022-04-25
1898,Comparing Agile and Waterfall Project Success Rates is like Comparing Apples to...,3,16,Marcus Glowasz,2022-04-25
1900,Why it’s Difficult for Young People to Buy a House,4,24,Thomas Guenter,2022-04-26
1901,Why Growth Stocks Are Crashing (And Might Continue To Do So),6,180,Thomas Herold,2022-04-26
1902,"Passive Income Machine or Scam? I Invested, So Let’s Find Out",4,139,Lauren Como,2022-04-26
1903,"A/B testing at Netflix, Uber, Pinterest, Google, LinkedIn, and Spotify- in easy words | Pitfalls of A/B Testing",7,63,Shaurya Uppal,2022-04-26
1904,Deglobalization Is Yet Another Way for the Rich to Exploit the Poor,8,253,U-Ming Lee,2022-04-26
1905,5 Cryptocurrencies We Are Buying with DCA Right Now & Why,9,515,Stephen Dalton,2022-04-26
1906,"<strong class=""markup--strong markup--h3-strong"">Metaverse NFT Marketplace Development — Making Waves in the Metaverse Space</strong>",3,51,Carina Rogers,2022-04-26
